"id";"uri";"siglaTipo";"numero";"ano";"codTipo";"descricaoTipo";"ementa";"ementaDetalhada";"keywords";"dataApresentacao";"uriOrgaoNumerador";"uriPropAnterior";"uriPropPrincipal";"uriPropPosterior";"urlInteiroTeor";"urnFinal";"ultimoStatus_dataHora";"ultimoStatus_sequencia";"ultimoStatus_uriRelator";"ultimoStatus_idOrgao";"ultimoStatus_siglaOrgao";"ultimoStatus_uriOrgao";"ultimoStatus_regime";"ultimoStatus_descricaoTramitacao";"ultimoStatus_idTipoTramitacao";"ultimoStatus_descricaoSituacao";"ultimoStatus_idSituacao";"ultimoStatus_despacho";"ultimoStatus_url"
"217308";"https://dadosabertos.camara.leg.br/api/v2/proposicoes/217308";"PL";"3938";"1966";"139";"Projeto de Lei";"CONCEDE ISENÇÃO DE TRIBUTOS, PELO PRAZO DE 10 ANOS, A PROPRIEDADE RURAL NÃO CONSIDERADA LATIFUNDIO NO POLIGONO DAS SECAS E NOUTRAS REGIÕES SUBDESENVOLVIDAS DO PAIS.";"";"CONCESSÃO, ISENÇÃO, TRIBUTOS, PROPRIEDADE RURAL, POLIGONO DAS SECAS, REGIÃO SUBDESENVOLVIDA, EXCEÇÃO, LATIFUNDIO.";"1966-09-26T00:00:00";"https://dadosabertos.camara.leg.br/api/v2/orgaos/180";"";"";"";"";"";"1967-03-09T00:00:00";"4";"";"4";"MESA";"https://dadosabertos.camara.leg.br/api/v2/orgaos/4";"Ordinária (Art. 151, III, RICD)";"Não Informado";"5";"Arquivada";"923";"ARQUIVADO NOS TERMOS DO ARTIGO 104 DO REGIMENTO INTERNO. DCN1 10 30 67 PAG 0567 COL 02.";""
"217317";"https://dadosabertos.camara.leg.br/api/v2/proposicoes/217317";"PL";"3939";"1966";"139";"Projeto de Lei";"REVOGA O ARTIGO 27 DA LEI Nº 4.506, DE 30 DE NOVEMBRO DE 1964 QUE DISPÕE SOBRE O IMPOSTO QUE RECAI SOBRE AS RENDAS E PROVENTOS DE QUALQUER NATUREZA E O ARTIGO 75 DO DECRETO Nº 58.400, DE 10 DE MAIO DE 1966, QUE APROVA O REGULAMENTO PARA A COBRANÇA E FISCALIZAÇÃO DO IMPOSTO DE RENDA E DA OUTRAS PROVIDENCIAS.";"";"ALTERAÇÃO, LEGISLAÇÃO, IMPOSTO DE RENDA, RENDIMENTO, AGRICULTURA, PECUARIA, INDUSTRIA EXTRATIVA, BENFEITORIA, TRANSFORMAÇÃO, MATERIA PRIMA, APLICAÇÃO, COEFICIENTE, DECLARAÇÃO DE BENS.";"1966-09-23T00:00:00";"https://dadosabertos.camara.leg.br/api/v2/orgaos/180";"";"";"";"";"";"1970-07-14T00:00:00";"4";"";"4";"MESA";"https://dadosabertos.camara.leg.br/api/v2/orgaos/4";"Ordinária (Art. 151, III, RICD)";"Não Informado";"5";"Arquivada";"923";"DESPACHO AO ARQUIVO (REJEITADO). DCN1 15 07 70 PAG 3131 COL 03.";""
"217326";"https://dadosabertos.camara.leg.br/api/v2/proposicoes/217326";"PL";"3940";"1966";"139";"Projeto de Lei";"ALTERA OS LIMITES DO MAR TERRITORIAL DO BRASIL, ESTABELECE UMA ZONA CONTIGUA E DA OUTRAS PROVIDENCIAS.";"";"ALTERAÇÃO, LIMITE GEOGRAFICO, MAR TERRITORIAL.";"1966-09-27T00:00:00";"https://dadosabertos.camara.leg.br/api/v2/orgaos/180";"";"";"";"";"";"1966-11-29T00:00:00";"3";"";"4";"MESA";"https://dadosabertos.camara.leg.br/api/v2/orgaos/4";"Ordinária (Art. 151, III, RICD)";"Não Informado";"5";"Arquivada";"923";"DEFERIDA A MSC007341966, DO AUTOR, SOLICITANDO A RETIRADA DESTE PROJETO. DCN1 30 11 66 PAG 7024 COL 04.";""
"217336";"https://dadosabertos.camara.leg.br/api/v2/proposicoes/217336";"PL";"3941";"1966";"139";"Projeto de Lei";"EXTINGUE OS CARGOS DE MINISTRO DE ASSUNTOS COMERCIAIS DE PRIMEIRA E SEGUNDA CLASSE.";"";"EXTINÇÃO, CARGO, MINISTRO DE SEGUNDA CLASSE, MINISTRO DE PRIMEIRA CLASSE, ASSUNTO, COMERCIO.";"1966-09-27T00:00:00";"https://dadosabertos.camara.leg.br/api/v2/orgaos/180";"";"";"";"";"";"1966-11-29T00:00:00";"3";"";"4";"MESA";"https://dadosabertos.camara.leg.br/api/v2/orgaos/4";"Ordinária (Art. 151, III, RICD)";"Não Informado";"5";"Arquivada";"923";"DEFERIDA A MSC007371966, DO AUTOR, SOLICITANDO A RETIRADA DESTE PROJETO. DCN1 30 11 66 PAG 7024 COL 04.";""
"217344";"https://dadosabertos.camara.leg.br/api/v2/proposicoes/217344";"PL";"3942";"1966";"139";"Projeto de Lei";"AUTORIZA O PODER EXECUTIVO A ABRIR, PELO MINISTERIO DA MARINHA, O CREDITO ESPECIAL DE Cr$ 424.716.780,00, CORRESPONDENTE AO EXCESSO DE ARRECADAÇÃO DO 'IMPOSTO DE FAROIS', NOS EXERCICIOS DE 1963, 1964 E 1965.";"";"AUTORIZAÇÃO, EXECUTIVO, ABERTURA, CREDITO ESPECIAL, (MM), EXCESSO DE ARRECADAÇÃO, IMPOSTO DE FAROIS.";"1966-09-27T00:00:00";"https://dadosabertos.camara.leg.br/api/v2/orgaos/180";"";"";"";"";"";"1967-01-25T00:00:00";"12";"";"4";"MESA";"https://dadosabertos.camara.leg.br/api/v2/orgaos/4";"Ordinária (Art. 151, III, RICD)";"Não Informado";"5";"Transformado em Norma Jurídica";"1140";"OFÍCIO 462/67, DO SENADO FEDERAL, ENCAMINHANDO AUTÓGRAFOS.
DCN1 23 01 67 PÁG 335 COL 03.";"http://www.camara.gov.br/proposicoesWeb/prop_mostrarintegra?codteor=1613665"
"217352";"https://dadosabertos.camara.leg.br/api/v2/proposicoes/217352";"PL";"3943";"1966";"139";"Projeto de Lei";"AUTORIZA O PODER EXECUTIVO A ABRIR, PELO MINISTERIO DAS RELAÇÕES EXTERIORES, O CREDITO ESPECIAL DE Cr$ 22.200.000,00 (VINTE E DOIS MILHÕES E DUZENTOS MIL CRUZEIROS) DESTINADO A AUXILIAR A ARQUIDIOCESE DA CIDADE DO MEXICO NA CONSTRUÇÃO DE UM TEMPLO DEDICADO A NOSSA SENHORA APARECIDA, NAQUELA CAPITAL.";"";"AUTORIZAÇÃO, EXECUTIVO, ABERTURA, CREDITO ESPECIAL, (MRE), AUXILIO FINANCEIRO, CONSTRUÇÃO, TEMPLO, MEXICO.";"1966-09-27T00:00:00";"https://dadosabertos.camara.leg.br/api/v2/orgaos/180";"";"";"";"";"";"1967-01-25T00:00:00";"12";"";"4";"MESA";"https://dadosabertos.camara.leg.br/api/v2/orgaos/4";"Ordinária (Art. 151, III, RICD)";"Não Informado";"5";"Transformado em Norma Jurídica";"1140";"OFÍCIO 461/67, DO SENADO FEDERAL, ENCAMINHANDO AUTÓGRAFOS SANCIONADOS. 
DCN1 23 01 67 PÁG 335 COL 03.";"http://www.camara.gov.br/proposicoesWeb/prop_mostrarintegra?codteor=1611693"
"217360";"https://dadosabertos.camara.leg.br/api/v2/proposicoes/217360";"PL";"3944";"1966";"139";"Projeto de Lei";"CRIA O INSTITUTO NACIONAL DO CINEMA E DA OUTRAS PROVIDENCIAS.";"";"CRIAÇÃO, (INC), CINEMA.";"1966-09-27T00:00:00";"https://dadosabertos.camara.leg.br/api/v2/orgaos/180";"";"";"";"";"";"1966-11-29T00:00:00";"3";"";"4";"MESA";"https://dadosabertos.camara.leg.br/api/v2/orgaos/4";"Ordinária (Art. 151, III, RICD)";"Não Informado";"5";"Arquivada";"923";"DEFERIDA A MS007431966, DO AUTOR, SOLICITANDO A RETIRADA DESTE PROJETO.";""
"217368";"https://dadosabertos.camara.leg.br/api/v2/proposicoes/217368";"PL";"3945";"1966";"139";"Projeto de Lei";"DISPÕE SOBRE A EMISSÃO E CIRCULAÇÃO DE CHEQUES, HARMONIZANDO-AS COM A CONVENÇÃO DE GENEBRA CONCERNENTE A LEI UNIFORME RELATIVA AO CHEQUE CONSOLIDA A LEGISLAÇÃO VIGENTE E DA OUTRAS PROVIDENCIAS.";"";"NORMAS, EMISSÃO, CIRCULAÇÃO, CHEQUE, ADAPTAÇÃO, CONVENÇÃO INTERNACIONAL, AVAL, PRESCRIÇÃO, PENALIDADE.";"1966-10-03T00:00:00";"https://dadosabertos.camara.leg.br/api/v2/orgaos/180";"";"";"";"";"";"1977-11-23T00:00:00";"55";"";"4";"MESA";"https://dadosabertos.camara.leg.br/api/v2/orgaos/4";"Ordinária (Art. 151, III, RICD)";"Não Informado";"5";"Arquivada";"923";"ARQUIVADO NOS TERMOS DO PARAGRAFO SEGUNDO DO ARTIGO 117 DO REGIMENTO INTERNO. DCN1 24 11 77 PAG 12015 COL 02.";""
"217378";"https://dadosabertos.camara.leg.br/api/v2/proposicoes/217378";"PL";"3946";"1966";"139";"Projeto de Lei";"AUTORIZA O PODER EXECUTIVO A ABRIR, PELO MINISTERIO DA FAZENDA, O CREDITO ESPECIAL DE Cr$ 13.515.963.777,00, PARA ATENDER A DESPESAS DECORRENTES DO AUMENTO DE VENCIMENTOS DE SERVIDORES DO PODER JUDICIARIO E DO TRIBUNAL DE CONTAS DA UNIÃO.";"";"AUTORIZAÇÃO, EXECUTIVO, ABERTURA, CREDITO ESPECIAL, MINISTÉRO DA FAZENDA (1891-1990), DESPESA, AUMENTO, VENCIMENTOS, SERVIDOR, JUDICIARIO, TRIBUNAL DE CONTAS DA UNNIÃO (TCU).";"1966-09-29T00:00:00";"https://dadosabertos.camara.leg.br/api/v2/orgaos/180";"";"";"";"";"";"1966-12-05T00:00:00";"8";"";"4";"MESA";"https://dadosabertos.camara.leg.br/api/v2/orgaos/4";"Ordinária (Art. 151, III, RICD)";"Não Informado";"5";"Transformado em Norma Jurídica";"1140";"OFÍCIO 337/66, DO SENADO FEDERAL, ENCAMINHANDO AUTÓGRAFOS.
DCN1 16 12 66 PÁG 7264 COL 03.";"http://www.camara.gov.br/proposicoesWeb/prop_mostrarintegra?codteor=1615223"
"217388";"https://dadosabertos.camara.leg.br/api/v2/proposicoes/217388";"PL";"3947";"1966";"139";"Projeto de Lei";"FIXA PRINCIPIOS E NORMAS DE ORGANIZAÇÃO PARA AS UNIVERSIDADES FEDERAIS E DA OUTRAS PROVIDENCIAS.";"";"FIXAÇÃO, NORMAS, ORGANIZAÇÃO, UNIVERSIDADE FEDERAL, ENSINO SUPERIOR.";"1966-09-29T00:00:00";"https://dadosabertos.camara.leg.br/api/v2/orgaos/180";"";"";"";"";"";"1966-11-29T00:00:00";"3";"";"4";"MESA";"https://dadosabertos.camara.leg.br/api/v2/orgaos/4";"Ordinária (Art. 151, III, RICD)";"Não Informado";"5";"Arquivada";"923";"DEFERIDA A MSC007381966, DO AUTOR, SOLICITANDO A RETIRADA DESTE PROJETO. DCN1 30 11 66 PAG 7024 COL 04.";""
"217397";"https://dadosabertos.camara.leg.br/api/v2/proposicoes/217397";"PL";"3948";"1966";"139";"Projeto de Lei";"INSTITUI O QUADRO DE PESSOAL DO MINISTERIO DAS MINAS E ENERGIA E DA OUTRAS PROVIDENCIAS.";"";"CRIAÇÃO, QUADRO DE PESSOAL, (MME).";"1966-10-06T00:00:00";"https://dadosabertos.camara.leg.br/api/v2/orgaos/180";"";"";"";"";"";"1966-12-19T00:00:00";"11";"";"4";"MESA";"https://dadosabertos.camara.leg.br/api/v2/orgaos/4";"Ordinária (Art. 151, III, RICD)";"Não Informado";"5";"Transformado em Norma Jurídica";"1140";"OFÍCIO 2068/66, DO SENADO FEDERAL, ENCAMINHANDO AUTÓGRAFOS SANCIONADOS.
DCN1 22 01 67 PÁG 282 COL 01.";"http://www.camara.gov.br/proposicoesWeb/prop_mostrarintegra?codteor=1615322"
"217405";"https://dadosabertos.camara.leg.br/api/v2/proposicoes/217405";"PL";"3949";"1966";"139";"Projeto de Lei";"AUTORIZA O PODER EXECUTIVO A ABRIR A PRESIDENCIA DA REPUBLICA (ORGÃOS DEPENDENTES: COORDENAÇÃO DOS ORGANISMOS REGIONAIS) - COMISSÃO ESPECIAL DA FAIXA DE FRONTEIRAS -  UM CREDITO ESPECIAL DE Cr$ 200.000.000 (DUZENTOS MILHÕES DE CRUZEIROS), DESTINADO A ATENDER AS DESPESAS DIRETAS DA REFERIDA COMISSÃO.";"";"AUTORIZAÇÃO, EXECUTIVO, ABERTURA, CREDITO ESPECIAL, PRESIDENCIA DA REPUBLICA, COMISSÃO ESPECIAL, FAIXA DE FRONTEIRA.";"1966-09-29T00:00:00";"https://dadosabertos.camara.leg.br/api/v2/orgaos/180";"";"";"";"";"";"1966-11-29T00:00:00";"3";"";"4";"MESA";"https://dadosabertos.camara.leg.br/api/v2/orgaos/4";"Ordinária (Art. 151, III, RICD)";"Não Informado";"5";"Arquivada";"923";"DEFERIDA A MSC007401966, DO AUTOR, SOLICITANDO A RETIRADA DESTE PROJETO. DCN1 30 11 66 PAG 7025 COL 01.";""
"217415";"https://dadosabertos.camara.leg.br/api/v2/proposicoes/217415";"PL";"3950";"1966";"139";"Projeto de Lei";"AUTORIZA O PODER EXECUTIVO A ABRIR, PELO MINISTERIO DA FAZENDA, O CREDITO ESPECIAL DE Cr$ 14.027.673,000,00, PARA INDENIZAÇÃO A COMPANHIA PORT OF PARA.";"";"AUTORIZAÇÃO, EXECUTIVO, ABERTURA, CREDITO ESPECIAL, (MF), INDENIZAÇÃO, EMPRESA ESTRANGEIRA, PORTO, (PA).";"1966-09-29T00:00:00";"https://dadosabertos.camara.leg.br/api/v2/orgaos/180";"";"";"";"";"";"1967-04-05T00:00:00";"14";"";"4";"MESA";"https://dadosabertos.camara.leg.br/api/v2/orgaos/4";"Ordinária (Art. 151, III, RICD)";"Não Informado";"5";"Transformado em Norma Jurídica";"1140";"OFÍCIO 763/67, DO SENADO FEDERAL, ENCAMINHANDO AUTÓGRAFOS SANCIONADOS.
DCN1 06 04 67 PÁG 1047 COL 02.";"http://www.camara.gov.br/proposicoesWeb/prop_mostrarintegra?codteor=1617142"
"217425";"https://dadosabertos.camara.leg.br/api/v2/proposicoes/217425";"PL";"3951";"1966";"139";"Projeto de Lei";"DISPÕE SOBRE NOVA DENOMINAÇÃO DE IMPOSTO DE CONSUMO, ALTERA A LEI Nº 4.502, DE 30 DE NOVEMBRO DE 1964, EXTINGUE DIVERSAS TAXAS E DA OUTRAS PROVIDENCIAS.";"";"ALTERAÇÃO, LEI FEDERAL,IMPOSTO DE CONSUMO, (IPI), IMPOSTOS, PRODUTO INDUSTRIALIZADO.";"1966-09-29T00:00:00";"https://dadosabertos.camara.leg.br/api/v2/orgaos/180";"";"";"";"";"";"1966-11-29T00:00:00";"3";"";"4";"MESA";"https://dadosabertos.camara.leg.br/api/v2/orgaos/4";"Ordinária (Art. 151, III, RICD)";"Não Informado";"5";"Arquivada";"923";"DEFERIDA A MSC007411966, DO AUTOR, SOLICITANDO A RETIRADA DESTE PROJETO. DCN1 30 11 66 PAG 7025 COL 01.";""
"217435";"https://dadosabertos.camara.leg.br/api/v2/proposicoes/217435";"PL";"3952";"1966";"139";"Projeto de Lei";"DESDOBRA EM DUAS UNIDADES UNIVERSITARIAS DISTINTAS A ATUAL FACULDADE DE FARMACIA E ODONTOLOGIA DA UNIVERSIDADE DO CEARA.";"";"DESDOBRAMENTO, UNIDADE UNIVERSITARIA, FACULDADE, FARMACIA, ODONTOLOGIA, UNIVERSIDADE, (CE).";"1966-10-03T00:00:00";"https://dadosabertos.camara.leg.br/api/v2/orgaos/180";"";"";"";"";"";"1967-01-25T00:00:00";"9";"";"4";"MESA";"https://dadosabertos.camara.leg.br/api/v2/orgaos/4";"Ordinária (Art. 151, III, RICD)";"Não Informado";"5";"Transformado em Norma Jurídica";"1140";"OFÍCIO 460/67, DO SENADO FEDERAL, ENCAMINHANDO AUTÓGRAFO SANCIONADO. 
DCN1 23 01 67 PÁG 335 COL 03.";"http://www.camara.gov.br/proposicoesWeb/prop_mostrarintegra?codteor=1612340"
"217444";"https://dadosabertos.camara.leg.br/api/v2/proposicoes/217444";"PL";"3953";"1966";"139";"Projeto de Lei";"AUTORIZA O PODER EXECUTIVO A ABRIR, O CREDITO ESPECIAL DE Cr$ 8.500.000.000,00, DESTINADO A ATENDER A DESPESAS DE QUALQUER NATUREZA DO GRUPO EXECUTIVO DE INTEGRAÇÃO DA POLITICA DE TRANSPORTES - GEIPOT - PARA A REALIZAÇÃO DE ESTUDOS DE ENGENHARIA QUE ESPECIFICA.";"";"AUTORIZAÇÃO, EXECUTIVO, ABERTURA, CREDITO ESPECIAL, ATENDIMENTO, DESPESA, (GEIPOT), REALIZAÇÃO, ESTUDO, ENGENHARIA, TRANSPORTE.";"1966-10-03T00:00:00";"https://dadosabertos.camara.leg.br/api/v2/orgaos/180";"";"";"";"";"";"1967-01-16T00:00:00";"3";"";"4";"MESA";"https://dadosabertos.camara.leg.br/api/v2/orgaos/4";"Ordinária (Art. 151, III, RICD)";"Transformação em Norma Jurídica";"251";"Transformado em Norma Jurídica";"1140";"TRANSFORMADO NA LEI 5206/67. DOFC 17 01 67.";""
"217453";"https://dadosabertos.camara.leg.br/api/v2/proposicoes/217453";"PL";"3954";"1966";"139";"Projeto de Lei";"AUTORIZA O PODER EXECUTIVO A ABRIR, PELO MINISTERIO DAS RELAÇÕES EXTERIORES, O CREDITO ESPECIAL DE Cr$ 120.000.000,00 (CENTO E VINTE MILHÕES DE CRUZEIROS), PARA ATENDER AS DESPESAS DECORRENTES DA VISITA AO BRASIL DE SUA ALTEZA EMINENTISSIMA FREI ANGELO DE MOJANA DI COLOGNA.";"";"AUTORIZAÇÃO, EXECUTIVO, ABERTURA, CREDITO ESPECIAL, (MRE), ATENDIMENTO, DESPESA, VISITA OFICIAL, AUTORIDADE RELIGIOSA.";"1966-10-03T00:00:00";"https://dadosabertos.camara.leg.br/api/v2/orgaos/180";"";"";"";"";"";"1967-01-25T00:00:00";"9";"";"4";"MESA";"https://dadosabertos.camara.leg.br/api/v2/orgaos/4";"Ordinária (Art. 151, III, RICD)";"Não Informado";"5";"Transformado em Norma Jurídica";"1140";"OFÍCIO 459/67, DO SENADO FEDERAL, ENCAMINHANDO AUTÓGRAFO SANCIONADO. 
DCN1 23 01 67 PÁG 335 COL 02.";"http://www.camara.gov.br/proposicoesWeb/prop_mostrarintegra?codteor=1606847"
"217462";"https://dadosabertos.camara.leg.br/api/v2/proposicoes/217462";"PL";"3955";"1966";"139";"Projeto de Lei";"ALTERA A REDAÇÃO DO ARTIGO SEXTO, PARAGRAFO UNICO DA LEI Nº 1.628, DE 26 DE JUNHO DE 1952, QUE DISPÕE SOBRE 'OBRIGAÇÕES DE REAPARELHAMENTO ECONOMICO'.";"";"ALTERAÇÃO, LEI FEDERAL, NORMAS, OBRIGAÇÕES DE REAPARELHAMENTO ECONOMICO.";"1966-10-03T00:00:00";"https://dadosabertos.camara.leg.br/api/v2/orgaos/180";"";"";"";"";"";"1967-01-25T00:00:00";"11";"";"4";"MESA";"https://dadosabertos.camara.leg.br/api/v2/orgaos/4";"Ordinária (Art. 151, III, RICD)";"Não Informado";"5";"Transformado em Norma Jurídica";"1140";"OFÍCIO 467/67, DO SENADO FEDERAL, ENCAMINHANDO AUTÓGRAFO SANCIONADO. 
DCN1 23 01 67 PÁG 335 COL 03.";"http://www.camara.gov.br/proposicoesWeb/prop_mostrarintegra?codteor=1613532"
"217471";"https://dadosabertos.camara.leg.br/api/v2/proposicoes/217471";"PL";"3956";"1966";"139";"Projeto de Lei";"ISENTA DO IMPOSTO DE IMPORTAÇÃO E DE CONSUMO EQUIPAMENTO IMPORTADO PELA COOPERATIVA CENTRAL DOS PRODUTORES RURAIS DE MINAS GERAIS LTDA., DESTINADO A AMPLIAÇÃO DE UMA FABRICA DE LEITE EM PO.";"";"ISENÇÃO, IMPOSTO DE IMPORTAÇÃO, IMPOSTO DE CONSUMO, EQUIPAMENTO, PRODUTO IMPORTADO, COOPERATIVA CENTRAL, PRODUTOR RURAL, AMPLIAÇÃO, FABRICA, LEITE EM PO, ESTADO, (MG).";"1966-10-03T00:00:00";"https://dadosabertos.camara.leg.br/api/v2/orgaos/180";"";"";"";"";"";"1967-01-12T00:00:00";"3";"";"4";"MESA";"https://dadosabertos.camara.leg.br/api/v2/orgaos/4";"Ordinária (Art. 151, III, RICD)";"Transformação em Norma Jurídica";"251";"Transformado em Norma Jurídica";"1140";"TRANSFORMADO NA LEI 5205/67. DOFC 13 01 67.";""
"217479";"https://dadosabertos.camara.leg.br/api/v2/proposicoes/217479";"PL";"3957";"1966";"139";"Projeto de Lei";"REVOGA A PARAGRAFO TERCEIRO DO ARTIGO 26 ACRESCENTADO PELA LEI Nº 4.686, DE 21 DE JUNHO DE 1965 AO DECRETO-LEI Nº 3.365, DE 21 DE JUNHO DE 1941, QUE DISPÕE SOBRE DESAPROPRIAÇÃO POR UTILIDADE PUBLICA.";"";"REVOGAÇÃO, DISPOSITIVO, DECRETO LEI FEDERAL, NORMAS, DESAPROPRIAÇÃO, UTILIDADE PUBLICA, CORREÇÃO MONETARIA.";"1966-10-03T00:00:00";"https://dadosabertos.camara.leg.br/api/v2/orgaos/180";"";"";"";"";"";"1967-01-19T00:00:00";"3";"";"4";"MESA";"https://dadosabertos.camara.leg.br/api/v2/orgaos/4";"Ordinária (Art. 151, III, RICD)";"Não Informado";"5";"Arquivada";"923";"VETADO TOTALMENTE. DCN2 25 01 67 PAG 0184. DCN1 03 03 67 PAG 0385 COL 02. MANTIDO O VETO. DCN1 14 04 67 PAG 0627 COL 04.";""
"217488";"https://dadosabertos.camara.leg.br/api/v2/proposicoes/217488";"PL";"3958";"1966";"139";"Projeto de Lei";"CRIA A AUDITORIA DA DECIMA PRIMEIRA REGIÃO MILITAR, E DA OUTRAS PROVIDENCIAS.";"";"CRIAÇÃO, AUDITORIA, REGIÃO MILITAR.";"1966-10-03T00:00:00";"https://dadosabertos.camara.leg.br/api/v2/orgaos/180";"";"";"";"";"";"1966-11-29T00:00:00";"3";"";"4";"MESA";"https://dadosabertos.camara.leg.br/api/v2/orgaos/4";"Ordinária (Art. 151, III, RICD)";"Não Informado";"5";"Arquivada";"923";"DEFERIDA A MSC007361966, DO AUTOR, SOLICITANDO A RETIRADA DESTE PROJETO. DCN1 30 11 66 PAG 7024 COL 04.";""
"217498";"https://dadosabertos.camara.leg.br/api/v2/proposicoes/217498";"PL";"3959";"1966";"139";"Projeto de Lei";"AUTORIZA O PODER EXECUTIVO A CEDER AO ESTADO DO RIO GRANDE DO SUL AS QUOTAS DE SERVIÇO MARITIMO SUL BRASIL LTDA. - SEMASUL.";"";"AUTORIZAÇÃO, PODER EXECUTIVO, CESSÃO, COTA, SERVIÇO MARÍTIMO SUL BRASIL (SEMASUL), RIO GRANDE DO SUL.";"1966-10-03T00:00:00";"https://dadosabertos.camara.leg.br/api/v2/orgaos/180";"";"";"";"";"";"1967-01-26T00:00:00";"13";"";"4";"MESA";"https://dadosabertos.camara.leg.br/api/v2/orgaos/4";"Ordinária (Art. 151, III, RICD)";"Não Informado";"5";"Transformado em Norma Jurídica";"1140";"OFÍCIO 469/67, DO SENADO FEDERAL, ENCAMINHANDO AUTÓGRAFO SANCIONADO. 
DCN1 23 01 67 PÁG 335 COL 04.";"http://www.camara.gov.br/proposicoesWeb/prop_mostrarintegra?codteor=1617177"
"217508";"https://dadosabertos.camara.leg.br/api/v2/proposicoes/217508";"PL";"3960";"1966";"139";"Projeto de Lei";"AUTORIZA O PODER EXECUTIVO A ABRIR, PELO MINISTERIO DA FAZENDA, O CREDITO ESPECIAL DE Cr$ 18.997.062.214,00 (DEZOITO BILHÕES, NOVECENTOS E NOVENTA E SETE MILHÕES, SESSENTA E DOIS MIL, DUZENTOS E QUATORZE CRUZEIROS) EM FAVOR DA POLICIA MILITAR DO ESTADO DA GUANABARA, PARA ATENDER AOS ENCARGOS DECORRENTES DA APLICAÇÃO DO DECRETO-LEI Nº 10, DE 28 DE JUNHO DE 1966.";"";"AUTORIZAÇÃO, EXECUTIVO, ABERTURA, CREDITO ESPECIAL, (MF), ATENDIMENTO, ENCARGO, APLICAÇÃO, DECRETO LEI FEDERAL, POLICIA MILITAR, ESTADO, (GB).";"1966-10-03T00:00:00";"https://dadosabertos.camara.leg.br/api/v2/orgaos/180";"";"";"";"";"";"1967-01-26T00:00:00";"11";"";"4";"MESA";"https://dadosabertos.camara.leg.br/api/v2/orgaos/4";"Ordinária (Art. 151, III, RICD)";"Não Informado";"5";"Transformado em Norma Jurídica";"1140";"OFÍCIO 481/67, DO SENADO FEDERAL, ENCAMINHANDO AUTÓGRAFO SANCIONADO. 
DCN1 23 01 67 PÁG 335 COL 04.";"http://www.camara.gov.br/proposicoesWeb/prop_mostrarintegra?codteor=1617115"
"217517";"https://dadosabertos.camara.leg.br/api/v2/proposicoes/217517";"PL";"3961";"1966";"139";"Projeto de Lei";"ATUALIZA O VALOR DA GRATIFICAÇÃO CONCEDIDA AOS MEMBROS DOS TRIBUNAIS ELEITORAIS, AO PROCURADOR-GERAL E AOS PROCURADORES REGIONAIS ELEITORAIS E AOS JUIZES E ESCRIVÃES ELEITORAIS.";"";"ATUALIZAÇÃO, VALOR, GRATIFICAÇÃO, CONCESSÃO, MEMBROS, TRIBUNAL REGIONAL ELEITORAL  (TRE), PROCURADOR GERAL, PROCURADOR REGIONAL, JUIZ ELEITORAL, ESCRIVÃO ELEITORAL.";"1966-10-03T00:00:00";"https://dadosabertos.camara.leg.br/api/v2/orgaos/180";"";"";"";"";"";"1967-01-26T00:00:00";"10";"";"4";"MESA";"https://dadosabertos.camara.leg.br/api/v2/orgaos/4";"Ordinária (Art. 151, III, RICD)";"Não Informado";"5";"Transformado em Norma Jurídica";"1140";"OFÍCIO 470/67, DO SENADO FEDERAL, ENCAMINHANDO AUTÓGRAFO SANCIONADO. 
DCN1 23 01 67 PÁG 335 COL 04.";"http://www.camara.gov.br/proposicoesWeb/prop_mostrarintegra?codteor=1618273"
"217526";"https://dadosabertos.camara.leg.br/api/v2/proposicoes/217526";"PL";"3962";"1966";"139";"Projeto de Lei";"AUTORIZA O PODER EXECUTIVO A ABRIR, PELO MINISTERIO DA FAZENDA, O CREDITO ESPECIAL DE Cr$ 172.369.000,00 (CENTO E SETENTA E DOIS MILHÕES, TREZENTOS E SESSENTA E NOVE MIL CRUZEIROS), DESTINADO A REGULARIZAR DESPESA COM A SUBSCRIÇÃO DE 172.369 AÇÕES DA COMPANHIA VALE DO RIO DOCE PELO TESOURO NACIONAL.";"";"AUTORIZAÇÃO, EXECUTIVO, ABERTURA, CREDITO ESPECIAL, (MF), REGULARIZAÇÃO, DESPESA, SUBSCRIÇÃO, AÇÕES, (CVRD), TESOURO NACIONAL.";"1966-10-06T00:00:00";"https://dadosabertos.camara.leg.br/api/v2/orgaos/180";"";"";"";"";"";"1967-01-26T00:00:00";"12";"";"4";"MESA";"https://dadosabertos.camara.leg.br/api/v2/orgaos/4";"Ordinária (Art. 151, III, RICD)";"Não Informado";"5";"Transformado em Norma Jurídica";"1140";"OFÍCIO 476/67, DO SENADO FEDERAL, ENCAMINHANDO AUTÓGRAFO SANCIONADO. 
DCN1 23 01 67 PÁG 335 COL 04.";"http://www.camara.gov.br/proposicoesWeb/prop_mostrarintegra?codteor=1617537"
"217536";"https://dadosabertos.camara.leg.br/api/v2/proposicoes/217536";"PL";"3963";"1966";"139";"Projeto de Lei";"ALTERA DISPOSITIVOS DA LEI Nº 2.180, DE 05 DE JANEIRO DE 1954, ALTERADA PELAS LEIS NºS 3.543, DE 11 DE FEVEREIRO DE 1959, E 5.054, DE 29 DE JUNHO DE 1966, QUE DISPÕE SOBRE O TRIBUNAL MARITIMO.";"";"ALTERAÇÃO, LEI FEDERAL, NORMAS, (TM).";"1966-10-06T00:00:00";"https://dadosabertos.camara.leg.br/api/v2/orgaos/180";"";"";"";"";"";"1966-11-29T00:00:00";"3";"";"4";"MESA";"https://dadosabertos.camara.leg.br/api/v2/orgaos/4";"Ordinária (Art. 151, III, RICD)";"Não Informado";"5";"Arquivada";"923";"DEFERIDA A MSC007351966, DO AUTOR, SOLICITANDO A RETIRADA DESTE PROJETO. DCN1 30 11 66 PAG 7024 COL 04.";""
"217545";"https://dadosabertos.camara.leg.br/api/v2/proposicoes/217545";"PL";"3964";"1966";"139";"Projeto de Lei";"AUTORIZA O PODER EXECUTIVO A ABRIR, PELO MINISTERIO DA FAZENDA, O CREDITO ESPECIAL DE Cr$ 8.050.000,00 (OITO MILHÕES E CINQUENTA MIL CRUZEIROS), DESTINADOS A DELEGACIA DO TESOURO NACIONAL, NO ESTADO DA BAHIA.";"";"AUTORIZAÇÃO, EXECUTIVO, ABERTURA, CREDITO ESPECIAL, (MF), DELEGACIA, TESOURO NACIONAL, ESTADO, (BA).";"1966-10-06T00:00:00";"https://dadosabertos.camara.leg.br/api/v2/orgaos/180";"";"";"";"";"";"1967-01-26T00:00:00";"12";"";"4";"MESA";"https://dadosabertos.camara.leg.br/api/v2/orgaos/4";"Ordinária (Art. 151, III, RICD)";"Não Informado";"5";"Transformado em Norma Jurídica";"1140";"OFÍCIO 477/67, DO SENADO FEDERAL, ENCAMINHANDO AUTÓGRAFO SANCIONADO. 
DCN1 23 01 67 PÁG 335 COL 04.";"http://www.camara.gov.br/proposicoesWeb/prop_mostrarintegra?codteor=1623741"
"217554";"https://dadosabertos.camara.leg.br/api/v2/proposicoes/217554";"PL";"3965";"1966";"139";"Projeto de Lei";"AUTORIZA A ABERTURA DE CREDITO ESPECIAL DE Cr$ 986.563.164,00 (NOVECENTOS E OITENTA E SEIS MILHÕES, QUINHENTOS E SESSENTA E TRES MIL, CENTO E SESSENTA E QUATRO CRUZEIROS), DESTINADO A RESTITUIÇÃO, PELA CAIXA DE AMORTIZAÇÃO, DE INDENIZAÇÃO TRABALHISTA E DA OUTRAS PROVIDENCIAS.";"";"AUTORIZAÇÃO, ABERTURA, CREDITO ESPECIAL, DESTINAÇÃO, RESTITUIÇÃO, INDENIZAÇÃO TRABALHISTA, CAIXA DE AMORTIZAÇÃO.";"1966-10-06T00:00:00";"https://dadosabertos.camara.leg.br/api/v2/orgaos/180";"";"";"";"";"";"1967-01-26T00:00:00";"11";"";"4";"MESA";"https://dadosabertos.camara.leg.br/api/v2/orgaos/4";"Ordinária (Art. 151, III, RICD)";"Não Informado";"5";"Transformado em Norma Jurídica";"1140";"OFÍCIO 479/67, DO SENADO FEDERAL, ENCAMINHANDO AUTÓGRAFO SANCIONADO. 
DCN1 23 01 67 PÁG 335 COL 04.";"http://www.camara.gov.br/proposicoesWeb/prop_mostrarintegra?codteor=1621510"
"217563";"https://dadosabertos.camara.leg.br/api/v2/proposicoes/217563";"PL";"3966";"1966";"139";"Projeto de Lei";"AUTORIZA A SUPERINTENDENCIA DOS SERVIÇOS DE TRANSPORTES DA BAIA DA GUANABARA A VENDER AS EMBARCAÇÕES QUE MENCIONA.";"";"AUTORIZAÇÃO, SUPERINTENDENCIA, SERVIÇO DE TRANSPORTE, BAIA DE GUANABARA, VENDA, EMBARCAÇÃO, CONCORRENCIA PUBLICA.";"1966-10-07T00:00:00";"https://dadosabertos.camara.leg.br/api/v2/orgaos/180";"";"";"";"";"";"1967-01-26T00:00:00";"14";"";"4";"MESA";"https://dadosabertos.camara.leg.br/api/v2/orgaos/4";"Ordinária (Art. 151, III, RICD)";"Não Informado";"5";"Transformado em Norma Jurídica";"1140";"OFÍCIO 478/67, DO SENADO FEDERAL, ENCAMINHANDO OS AUTÓGRAFOS SANCIONADOS.
DCN1 23 01 67 PÁG 335 COL 01.";"http://www.camara.gov.br/proposicoesWeb/prop_mostrarintegra?codteor=1613148"
"217573";"https://dadosabertos.camara.leg.br/api/v2/proposicoes/217573";"PL";"3967";"1966";"139";"Projeto de Lei";"CRIA CARGOS DE PROFESSOR CATEDRATICO NA FACULDADE DE FILOSOFIA, CIENCIAS E LETRAS, DA UNIVERSIDADE FEDERAL DO ESPIRITO SANTO.";"";"CRIAÇÃO, CARGO, PROFESSOR CATEDRATICO, FACULDADE, FILOSOFIA, CIENCIAS, LETRAS, (UFES).";"1966-10-07T00:00:00";"https://dadosabertos.camara.leg.br/api/v2/orgaos/180";"";"";"";"";"";"1967-03-09T00:00:00";"16";"";"4";"MESA";"https://dadosabertos.camara.leg.br/api/v2/orgaos/4";"Ordinária (Art. 151, III, RICD)";"Não Informado";"5";"Transformado em Norma Jurídica";"1140";"LEITURA DO OFÍCIO 717, DO SENADO FEDERAL, ENCAMINHANDO OS AUTÓGRAFOS SANCIONADOS.
DCN1 05 04 67 PÁG 1015 COL 02.";"http://www.camara.gov.br/proposicoesWeb/prop_mostrarintegra?codteor=1630797"
