"id";"uri";"siglaTipo";"numero";"ano";"codTipo";"descricaoTipo";"ementa";"ementaDetalhada";"keywords";"dataApresentacao";"uriOrgaoNumerador";"uriPropAnterior";"uriPropPrincipal";"uriPropPosterior";"urlInteiroTeor";"urnFinal";"ultimoStatus_dataHora";"ultimoStatus_sequencia";"ultimoStatus_uriRelator";"ultimoStatus_idOrgao";"ultimoStatus_siglaOrgao";"ultimoStatus_uriOrgao";"ultimoStatus_regime";"ultimoStatus_descricaoTramitacao";"ultimoStatus_idTipoTramitacao";"ultimoStatus_descricaoSituacao";"ultimoStatus_idSituacao";"ultimoStatus_despacho";"ultimoStatus_url"
"213457";"https://dadosabertos.camara.leg.br/api/v2/proposicoes/213457";"PL";"3518";"1966";"139";"Projeto de Lei";"DA NOVA REDAÇÃO AO ARTIGO 35 DA LEI Nº 1.711, DE 28 DE OUTUBRO DE 1952 (ESTATUTO DOS FUNCIONÁRIOS PÚBLICOS CIVIS DA UNIÃO).";"ESTATUTO DOS FUNCIONARIOS PUBLICOS CIVIS DA UNIÃO. OBRIGATORIEDADE DE REFERENCIA ESPECIAL AO TITULO PROFISSIONAL DE FUNCIONARIO PUBLICO CIVIL DA UNIÃO.";"ALTERAÇÃO, ESTATUTO DOS FUNCIONARIOS PUBLICOS, OBRIGATORIEDADE, REFERENCIA, CLASSE ESPECIAL, TITULO, CURSO SUPERIOR, FUNCIONARIO PUBLICO.";"1966-03-22T00:00:00";"https://dadosabertos.camara.leg.br/api/v2/orgaos/180";"";"";"";"";"";"1967-10-10T00:00:00";"20";"";"4";"MESA";"https://dadosabertos.camara.leg.br/api/v2/orgaos/4";"Ordinária (Art. 151, III, RICD)";"Não Informado";"5";"Transformado em Norma Jurídica";"1140";"OF. 1.970/67, DO SENADO FEDERAL, ENCAMINHANDO AUTÓGRAFO. DCN1 11 10 67 PÁG 6.468 COL 03.
REPUBLICAÇÃO: DCN1 30 11 67 PÁG 8.444 COL 03.";"http://www.camara.gov.br/proposicoesWeb/prop_mostrarintegra?codteor=1019582"
"213465";"https://dadosabertos.camara.leg.br/api/v2/proposicoes/213465";"PL";"3519";"1966";"139";"Projeto de Lei";"DISPÕE SOBRE A JORNADA NORMAL DE TRABALHO DOS PROFISSIONAIS DE ENFERMAGEM.";"";"NORMAS, JORNADA DE TRABALHO, PROFISSÃO, ENFERMAGEM.";"1966-03-22T00:00:00";"https://dadosabertos.camara.leg.br/api/v2/orgaos/180";"";"";"";"";"";"1970-08-05T00:00:00";"3";"";"4";"MESA";"https://dadosabertos.camara.leg.br/api/v2/orgaos/4";"Ordinária (Art. 151, III, RICD)";"Não Informado";"5";"Arquivada";"923";"DESPACHO AO ARQUIVO (REJEITADO). DCN1 06 08 70 PAG 3663 COL 01.";""
"213473";"https://dadosabertos.camara.leg.br/api/v2/proposicoes/213473";"PL";"3520";"1966";"139";"Projeto de Lei";"ACRESCENTA A BIENAL DE SÃO PAULO O TITULO DE 'FUNDAÇÃO DO BRASIL', SOB A ORIENTAÇÃO DO MUSEU NACIONAL DE BELAS ARTES.";"";"ALTERAÇÃO, DENOMINAÇÃO, EXPOSIÇÃO, MUNICIPIO, SÃO PAULO (SP), SÃO PAULO (ESTADO), ORIENTAÇÃO, MUSEU NACIONAL DE BELAS ARTES (MNBA).";"1966-03-23T00:00:00";"https://dadosabertos.camara.leg.br/api/v2/orgaos/180";"";"";"";"";"";"1967-03-09T00:00:00";"4";"";"4";"MESA";"https://dadosabertos.camara.leg.br/api/v2/orgaos/4";"Ordinária (Art. 151, III, RICD)";"Não Informado";"5";"Arquivada";"923";"ARQUIVADO NOS TERMOS DO ARTIGO 104 DO REGIMENTO INTERNO. DCN1 10 03 67 PAG 0564 COL 02.";""
"213483";"https://dadosabertos.camara.leg.br/api/v2/proposicoes/213483";"PL";"3521";"1966";"139";"Projeto de Lei";"PROIBE CERIMONIA DE DEGRADAÇÃO NA EXPULSÃO DE MILITARES.";"";"PROIBIÇÃO, CERIMONIA, EXPULSÃO, MILITAR.";"1966-03-23T00:00:00";"https://dadosabertos.camara.leg.br/api/v2/orgaos/180";"";"";"";"";"";"1967-03-09T00:00:00";"4";"";"4";"MESA";"https://dadosabertos.camara.leg.br/api/v2/orgaos/4";"Ordinária (Art. 151, III, RICD)";"Não Informado";"5";"Arquivada";"923";"ARQUIVADO NOS TERMOS DO ARTIGO 104 DO REGIMENTO INTERNO. DCN1 10 03 67 PAG 0564 COL 02.";""
"213493";"https://dadosabertos.camara.leg.br/api/v2/proposicoes/213493";"PL";"3522";"1966";"139";"Projeto de Lei";"ALTERA A DENOMINAÇÃO DA CLASSE DE VISITADOR DE ALIMENTAÇÃO, DO SAPS.";"";"ALTERAÇÃO, DENOMINAÇÃO, CLASSE, FISCAL, ALIMENTAÇÃO, (SAPS).";"1966-03-22T00:00:00";"https://dadosabertos.camara.leg.br/api/v2/orgaos/180";"";"";"";"";"";"1967-03-09T00:00:00";"4";"";"4";"MESA";"https://dadosabertos.camara.leg.br/api/v2/orgaos/4";"Ordinária (Art. 151, III, RICD)";"Não Informado";"5";"Arquivada";"923";"ARQUIVADO NOS TERMOS DO ARTIGO 104 DO REGIMENTO INTERNO. DCN1 10 03 67 PAG 0564 COL 03.";""
"213502";"https://dadosabertos.camara.leg.br/api/v2/proposicoes/213502";"PL";"3523";"1966";"139";"Projeto de Lei";"AUTORIZA O PODER EXECUTIVO A ABRIR, NA CAPITAL DA REPUBLICA, UM MONUMENTO EM MEMORIA DA PRINCESA ISABEL, PARA GUARDA DE SEUS DESPOJOS.";"";"AUTORIZAÇÃO, EXECUTIVO, ABERTURA DE CREDITO, CONSTRUÇÃO, MONUMENTO, PERSONAGEM ILUSTRE, ESCRAVATURA.";"1966-03-23T00:00:00";"https://dadosabertos.camara.leg.br/api/v2/orgaos/180";"";"";"";"";"";"1967-03-09T00:00:00";"4";"";"4";"MESA";"https://dadosabertos.camara.leg.br/api/v2/orgaos/4";"Ordinária (Art. 151, III, RICD)";"Não Informado";"5";"Arquivada";"923";"ARQUIVADO NOS TERMOS DO ARTIGO 104 DO REGIMENTO INTERNO. DCN1 10 03 67 PAG 0564 COL 03.";""
"213510";"https://dadosabertos.camara.leg.br/api/v2/proposicoes/213510";"PL";"3524";"1966";"139";"Projeto de Lei";"TRANSFORMA A COOPERATIVA DO LIVRO ESCOLAR, DO MINISTERIO DA EDUCAÇÃO E CULTURA, EM COOPERATIVA ESTUDANTIL, COM A FINALIDADE DE FINANCIAR LIVROS, FARDAMENTOS E ANUIDADES ESCOLARES.";"";"TRANSFORMAÇÃO, COOPERATIVA ESCOLAR, LIVRO DIDATICO, (MEC), OBJETIVO, FINANCIAMENTO, LIVRO, UNIFORME, ANUIDADE.";"1966-03-23T00:00:00";"https://dadosabertos.camara.leg.br/api/v2/orgaos/180";"";"";"";"";"";"1967-03-09T00:00:00";"4";"";"4";"MESA";"https://dadosabertos.camara.leg.br/api/v2/orgaos/4";"Ordinária (Art. 151, III, RICD)";"Não Informado";"5";"Arquivada";"923";"ARQUIVADO NOS TERMOS DO REGIMENTO INTERNO. DCN1 10 03 67 PAG 0564 COL 03.";""
"213519";"https://dadosabertos.camara.leg.br/api/v2/proposicoes/213519";"PL";"3525";"1966";"139";"Projeto de Lei";"DISPÕE SOBRE O CODIGO SANITARIO DO DISTRITO FEDERAL.";"";"CRIAÇÃO, CODIGO SANITARIO, DISTRITO FEDERAL, DEFINIÇÃO COMPETENCIA, PROTEÇÃO, PROMOÇÃO, RECUPERAÇÃO, SUBVENÇÃO, AREA, SAUDE.";"1966-03-21T00:00:00";"https://dadosabertos.camara.leg.br/api/v2/orgaos/180";"";"";"";"";"";"1966-06-16T00:00:00";"16";"";"4";"MESA";"https://dadosabertos.camara.leg.br/api/v2/orgaos/4";"Ordinária (Art. 151, III, RICD)";"Não Informado";"5";"Transformado em Norma Jurídica";"1140";"MENSAGEM 359/66, DA PRESIDENCIA DA REPUBLICIA, ENCAMINHANDO AUTOGRAFOS DESTE PROJETO SANCIONADO.
DCN1 01 07 66 PAG 4358 COL 02.";"http://www.camara.gov.br/proposicoesWeb/prop_mostrarintegra?codteor=1019746"
"213528";"https://dadosabertos.camara.leg.br/api/v2/proposicoes/213528";"PL";"3526";"1966";"139";"Projeto de Lei";"DA NOVA REDAÇÃO AO ARTIGO 134 DO CODIGO CIVIL.";"";"ALTERAÇÃO, CODIGO CIVIL, ESCRITURA PUBLICA.";"1966-03-08T00:00:00";"https://dadosabertos.camara.leg.br/api/v2/orgaos/180";"";"";"";"";"";"1971-04-01T00:00:00";"4";"";"4";"MESA";"https://dadosabertos.camara.leg.br/api/v2/orgaos/4";"Ordinária (Art. 151, III, RICD)";"Não Informado";"5";"Arquivada";"923";"ARQUIVADO NOS TERMOS DO ARTIGO 104 DO REGIMENTO INTERNO. DCN1 02 04 71 PAG 0029 COL 04.";""
"213537";"https://dadosabertos.camara.leg.br/api/v2/proposicoes/213537";"PL";"3527";"1966";"139";"Projeto de Lei";"RETIFICA, SEM ONUS PARA A UNIÃO, A LEI Nº 4.900, DE 10 DE DEZEMBRO DE 1965, QUE ESTIMA A RECEITA E FIXA A DESPESA DA UNIÃO PARA O EXERCICIO DE 1966.";"";"ALTERAÇÃO, LEI FEDERAL, ESTIMATIVA, RECEITA, FIXAÇÃO, DESPESA, UNIÃO FEDERAL.";"1966-03-24T00:00:00";"https://dadosabertos.camara.leg.br/api/v2/orgaos/180";"";"";"";"";"";"1966-12-01T00:00:00";"4";"";"4";"MESA";"https://dadosabertos.camara.leg.br/api/v2/orgaos/4";"Ordinária (Art. 151, III, RICD)";"Não Informado";"5";"Arquivada";"923";"ARQUIVADO NOS TERMOS DO REGIMENTO INTERNO.";""
"213547";"https://dadosabertos.camara.leg.br/api/v2/proposicoes/213547";"PL";"3528";"1966";"139";"Projeto de Lei";"CONCEDE MORATORIA AOS LAVRADORES VITIMAS DE ENCHENTES NO ESTADO DE SANTA CATARINA.";"";"CONCESSÃO, MORATORIA, TRABALHADOR RURAL, VITIMA, INUNDAÇÃO, SANTA CATARINA.";"1966-03-04T00:00:00";"https://dadosabertos.camara.leg.br/api/v2/orgaos/180";"";"";"";"";"";"1969-11-30T00:00:00";"4";"";"4";"MESA";"https://dadosabertos.camara.leg.br/api/v2/orgaos/4";"Ordinária (Art. 151, III, RICD)";"Não Informado";"5";"Arquivada";"923";"ARQUIVADO NOS TERMOS DO ARTIGO 58 PARAGRAFO SEGUNDO DA CONSTITUIÇÃO FEDERAL E ARTIGOS 182 E 197 DO REGIMENTO INTERNO. DCN1 01 12 69 PAG 0749 COL 02.";""
"213556";"https://dadosabertos.camara.leg.br/api/v2/proposicoes/213556";"PL";"3529";"1966";"139";"Projeto de Lei";"ALTERA A REDAÇÃO DO ARTIGO 82, 'CAPUT', DO DECRETO-LEI Nº 7.661, DE 21 JUNHO DE 1945 (LEI DE FALENCIAS).";"";"ALTERAÇÃO, LEI DE FALENCIAS, OBRIGATORIEDADE, PARTICIPAÇÃO, ADVOGADO, HABILITAÇÃO DE CREDITO.";"1966-03-23T00:00:00";"https://dadosabertos.camara.leg.br/api/v2/orgaos/180";"";"";"";"";"";"1971-04-01T00:00:00";"4";"";"4";"MESA";"https://dadosabertos.camara.leg.br/api/v2/orgaos/4";"Ordinária (Art. 151, III, RICD)";"Não Informado";"5";"Arquivada";"923";"ARQUIVADO NOS TERMOS DO ARTIGO 104 DO REGIMENTO INTERNO. DCN1 02 04 71 PAG 0030 COL 01.";""
"213566";"https://dadosabertos.camara.leg.br/api/v2/proposicoes/213566";"PL";"3530";"1966";"139";"Projeto de Lei";"CRIA O DIA DO GUARDA CIVIL.";"";"CRIAÇÃO, DIA NACIONAL, GUARDA CIVIL.";"1966-03-23T00:00:00";"https://dadosabertos.camara.leg.br/api/v2/orgaos/180";"";"";"";"";"";"1966-09-08T00:00:00";"14";"";"4";"MESA";"https://dadosabertos.camara.leg.br/api/v2/orgaos/4";"Ordinária (Art. 151, III, RICD)";"Não Informado";"5";"Transformado em Norma Jurídica";"1140";"OFÍCIO 2358/66, DO SENADO FEDERAL, ENCAMINHANDO AUTÓGRAFO SANCIONADO. 
DCN1 22 09 66 PÁG 6120 COL 01.";"http://www.camara.gov.br/proposicoesWeb/prop_mostrarintegra?codteor=1570070"
"213576";"https://dadosabertos.camara.leg.br/api/v2/proposicoes/213576";"PL";"3531";"1966";"139";"Projeto de Lei";"CRIA O BANCO DA EDUCAÇÃO, DIRETAMENTE VINCULADO AO MINISTERIO DA EDUCAÇÃO E CULTURA E DA OUTRAS PROVIDENCIAS.";"";"CRIAÇÃO, INSTITUIÇÃO FINANCEIRA, EDUCAÇÃO, VINCULAÇÃO, (MEC).";"1966-03-23T00:00:00";"https://dadosabertos.camara.leg.br/api/v2/orgaos/180";"";"";"";"";"";"1967-03-09T00:00:00";"4";"";"4";"MESA";"https://dadosabertos.camara.leg.br/api/v2/orgaos/4";"Ordinária (Art. 151, III, RICD)";"Não Informado";"5";"Arquivada";"923";"ARQUIVADO NOS TERMOS DO ARTIGO 104 REGIMENTO INTERNO. DCN1 10 03 67 PAG 0564 COL 03.";""
"213585";"https://dadosabertos.camara.leg.br/api/v2/proposicoes/213585";"PL";"3532";"1966";"139";"Projeto de Lei";"TORNA OBRIGATORIA, NOS ROTULOS DAS BEBIDAS, A INDICAÇÃO DE SUA FORMULA.";"";"OBRIGATORIEDADE, INDICAÇÃO, FORMULA, ROTULO, BEBIDA ALCOOLICA.";"1966-03-23T00:00:00";"https://dadosabertos.camara.leg.br/api/v2/orgaos/180";"";"";"";"";"";"1967-03-09T00:00:00";"4";"";"4";"MESA";"https://dadosabertos.camara.leg.br/api/v2/orgaos/4";"Ordinária (Art. 151, III, RICD)";"Não Informado";"5";"Arquivada";"923";"ARQUIVADO NOS TERMOS DO ARTIGO 104 DO REGIMENTO INTERNO. DCN1 10 03 67 PAG 0564 COL 03.";""
"213594";"https://dadosabertos.camara.leg.br/api/v2/proposicoes/213594";"PL";"3533";"1966";"139";"Projeto de Lei";"CRIA O 'FUNDO DE INDENIZAÇÕES' MODIFICA A CONSOLIDAÇÃO DA LEIS DO TRABALHO E DA OUTRAS PROVIDENCIAS.";"";"CRIAÇÃO, FUNDOS, INDENIZAÇÃO, ALTERAÇÃO, CONSOLIDAÇÃO DAS LEIS DO TRABALHO (CLT), LEGISLAÇÃO TRABALHISTA.";"1966-03-23T00:00:00";"https://dadosabertos.camara.leg.br/api/v2/orgaos/180";"";"";"";"";"";"1967-03-09T00:00:00";"4";"";"4";"MESA";"https://dadosabertos.camara.leg.br/api/v2/orgaos/4";"Ordinária (Art. 151, III, RICD)";"Não Informado";"5";"Arquivada";"923";"ARQUIVADO NOS TERMOS DO ARTIGO 104 DO REGIMENTO INTERNO. DCN1 10 03 67 PAG 0564 COL 03.";""
"213604";"https://dadosabertos.camara.leg.br/api/v2/proposicoes/213604";"PL";"3534";"1966";"139";"Projeto de Lei";"ACRESCENTA PARAGRAFOS AO ARTIGO 14 DO DECRETO-LEI Nº 4.545, DE 31 DE JULHO DE 1942, QUE DISPÕE SOBRE A FORMA E A APRESENTAÇÃO DOS SIMBOLOS NACIONAIS.";"OBRIGANDO A COLOCAÇÃO DE BANDEIRA NACIONAL EM TODOS AS SALAS DE AULA.";"ALTERAÇÃO, DECRETO LEI FEDERAL, APRESENTAÇÃO, SIMBOLOS NACIONAIS, OBRIGATORIEDADE, BANDEIRA NACIONAL, ESTABELECIMENTO DE ENSINO.";"1966-03-24T00:00:00";"https://dadosabertos.camara.leg.br/api/v2/orgaos/180";"";"";"";"";"";"1967-03-16T00:00:00";"4";"";"4";"MESA";"https://dadosabertos.camara.leg.br/api/v2/orgaos/4";"Ordinária (Art. 151, III, RICD)";"Não Informado";"5";"Arquivada";"923";"ARQUIVADO NOS TERMOS DO REGIMENTO INTERNO. DCN1 17 08 66 PAG 4958 COL 02.";""
"213614";"https://dadosabertos.camara.leg.br/api/v2/proposicoes/213614";"PL";"3535";"1966";"139";"Projeto de Lei";"CONCEDE ISENÇÃO DE MULTA A BRASILEIROS NATOS COM 19 OU MAIS ANOS DE IDADE E AOS NATURALIZADOS COM 1 OU MAIS DE ADQUIRIDA A NACIONALIDADE BRASILEIRA, QUE SE ALISTAREM ELEITORES ATE O PLEITO DE 15 DE NOVEMBRO DE 1966.";"";"CONCESSÃO, ISENÇÃO, BRASILEIRO NATO, LIMITE DE IDADE,ALISTAMENTO ELEITORAL.";"1966-03-24T00:00:00";"https://dadosabertos.camara.leg.br/api/v2/orgaos/180";"";"";"";"";"";"1967-03-09T00:00:00";"4";"";"4";"MESA";"https://dadosabertos.camara.leg.br/api/v2/orgaos/4";"Ordinária (Art. 151, III, RICD)";"Não Informado";"5";"Arquivada";"923";"ARQUIVADO NOS TERMOS DO ARTIGO 104 DO REGIMENTO INTERNO. DCN1 10 03 67 PAG 0564 COL 03.";""
"213623";"https://dadosabertos.camara.leg.br/api/v2/proposicoes/213623";"PL";"3536";"1966";"139";"Projeto de Lei";"DETERMINA QUE OS NOVOS NIVEIS DE SALARIO-MINIMO NÃO ACARRETEM REAJUSTE DOS ALUGUEL, NA LOCAÇÃO DE PREDIOS RESIDENCIAIS.";"";"ALTERAÇÃO, SALARIO MINIMO, PROIBIÇÃO, REAJUSTAMENTO, ALUGUEL, IMOVEL RESIDENCIAL.";"1966-03-24T00:00:00";"https://dadosabertos.camara.leg.br/api/v2/orgaos/180";"";"";"";"";"";"1968-02-09T00:00:00";"4";"";"4";"MESA";"https://dadosabertos.camara.leg.br/api/v2/orgaos/4";"Ordinária (Art. 151, III, RICD)";"Não Informado";"5";"Arquivada";"923";"DESPACHO AO ARQUIVO (REJEITADO). DCN1 10 02 68 PAG 0740 COL 02.";""
"213632";"https://dadosabertos.camara.leg.br/api/v2/proposicoes/213632";"PL";"3537";"1966";"139";"Projeto de Lei";"MODIFICA O ARTIGO 47 DA LEI Nº 3.807, DE 26 DE AGOSTO DE 1960 (LEI ORGANICA DA PREVIDENCIA SOCIAL). (LIVRE ESCOLHA DO MEDICO, POR PARTE DOS BENEFICIARIOS DA PREVIDENCIA SOCIAL).";"";"ALTERAÇÃO, LEI ORGANICA DA PREVIDENCIA SOCIAL, LISTA DE ESCOLHA, MEDICO, BENEFICIARIO, PREVIDENCIA SOCIAL.";"1966-03-24T00:00:00";"https://dadosabertos.camara.leg.br/api/v2/orgaos/180";"";"";"";"";"";"1967-03-09T00:00:00";"4";"";"4";"MESA";"https://dadosabertos.camara.leg.br/api/v2/orgaos/4";"Ordinária (Art. 151, III, RICD)";"Não Informado";"5";"Arquivada";"923";"ARQUIVADO NOS TERMOS DO ARTIGO 104 DO REGIMENTO INTERNO. DCN1 10 03 67 PAG 0564 COL 03.";""
"213642";"https://dadosabertos.camara.leg.br/api/v2/proposicoes/213642";"PL";"3538";"1966";"139";"Projeto de Lei";"AUTORIZA O PODER EXECUTIVO A ABRIR, PELO MINISTERIO DA AERONAUTICA O CREDITO ESPECIAL DE Cr$ 1.500.000.000,00, PARA ATENDER DESPESAS COM A MANUTENÇÃO DOS SERVIÇOS AFETOS A SEGURANÇA DO TRAFEGO AEREO.";"";"Autorização, Executivo, crédito especial,  Ministério da Aeronáutica, manutenção, tráfego aéreo.";"1966-03-22T00:00:00";"https://dadosabertos.camara.leg.br/api/v2/orgaos/180";"";"";"";"";"";"1966-07-28T00:00:00";"29";"";"4";"MESA";"https://dadosabertos.camara.leg.br/api/v2/orgaos/4";"Ordinária (Art. 151, III, RICD)";"Não Informado";"5";"Transformado em Norma Jurídica";"1140";"OFÍCIO 1484/66, AO SENADO FEDERAL, ENCAMINHANDO UM DOS AUTÓGRAFOS. 
DCN1 03 08 66 PÁG 4586 COL 01.";"http://www.camara.gov.br/proposicoesWeb/prop_mostrarintegra?codteor=1572031"
"213651";"https://dadosabertos.camara.leg.br/api/v2/proposicoes/213651";"PL";"3539";"1966";"139";"Projeto de Lei";"REVOGA DISPOSITIVOS DA LEI Nº 4.213, DE 14 DE FEVEREIRO DE 1963, QUE REORGANIZA O DEPARTAMENTO NACIONAL DE PORTOS, RIOS E CANAIS E DA OUTRAS PROVIDENCIAS.";"";"REVOGAÇÃO, LEI FEDERAL, REORGANIZAÇÃO, (DNPRC).";"1966-03-22T00:00:00";"https://dadosabertos.camara.leg.br/api/v2/orgaos/180";"";"";"";"";"";"1966-05-26T00:00:00";"18";"";"4";"MESA";"https://dadosabertos.camara.leg.br/api/v2/orgaos/4";"Ordinária (Art. 151, III, RICD)";"Não Informado";"5";"Transformado em Norma Jurídica";"1140";"OF. 1.293/66, DO SENADO FEDERAL, ENCAMINHANDO AUTÓGRAFOS. DCN1 11 06 66 PÁG 3.659 COL 04.";"http://www.camara.gov.br/proposicoesWeb/prop_mostrarintegra?codteor=1019725"
"213661";"https://dadosabertos.camara.leg.br/api/v2/proposicoes/213661";"PL";"3540";"1966";"139";"Projeto de Lei";"ALTERA O PARAGRAFO SEGUNDO DO ARTIGO SEXTO DO DECRETO Nº 57.299, DE 22 DE NOVEMBRO DE 1965, QUE BAIXA NORMAS TECNICAS ESPECIAIS PARA INGRESSO E FIXAÇÃO DE ESTRANGEIROS NO PAIS.";"VISTO CONSULTAR - INGRESSO E FIXAÇÃO NO BRASIL DE MENORES DE 14 E MAIORES DE 60 ANOS QUE SEJAM ASCENDENTES E DESCENDENTES DIRETOS DE IMIGRANTES QUALIFICADOS OU DESTES DEPENDAM DIRETAMENTE).";"ALTERAÇÃO, DECRETO FEDERAL, FIXAÇÃO, NORMAS TECNICAS, INGRESSO, ESTRANGEIRO, TERRITORIO NACIONAL.";"1966-03-24T00:00:00";"https://dadosabertos.camara.leg.br/api/v2/orgaos/180";"";"";"";"";"";"1967-03-09T00:00:00";"4";"";"4";"MESA";"https://dadosabertos.camara.leg.br/api/v2/orgaos/4";"Ordinária (Art. 151, III, RICD)";"Não Informado";"5";"Arquivada";"923";"ARQUIVADO NOS TERMOS DO ARTIGO 104 DO REGIMENTO INTERNO. DCN1 10 03 67 PAG 0564 COL 03.";""
"213671";"https://dadosabertos.camara.leg.br/api/v2/proposicoes/213671";"PL";"3541";"1966";"139";"Projeto de Lei";"DISPÕE SOBRE AS CERTIDÕES DE REGISTRO DE NASCIMENTO.";"";"NORMAS, CERTIDÃO, REGISTRO DE NASCIMENTO.";"1966-03-24T00:00:00";"https://dadosabertos.camara.leg.br/api/v2/orgaos/180";"";"";"";"";"";"1967-03-09T00:00:00";"4";"";"4";"MESA";"https://dadosabertos.camara.leg.br/api/v2/orgaos/4";"Ordinária (Art. 151, III, RICD)";"Não Informado";"5";"Arquivada";"923";"ARQUIVADO NOS TERMOS DO ARTIGO 104 DO REGIMENTO INTERNO. DCN1 10 03 67 PAG 0564 COL 03.";""
"213681";"https://dadosabertos.camara.leg.br/api/v2/proposicoes/213681";"PL";"3542";"1966";"139";"Projeto de Lei";"ALTERA O ARTIGO PRIMEIRO DA LEI Nº 4.929, DE 18 DE FEVEREIRO DE 1966, QUE PRORROGA OS PRAZOS DE VALIDADE DOS CONCURSOS PUBLICOS EM VIGOR.";"";"ALTERAÇÃO, LEI FEDERAL, PRORROGAÇÃO, PRAZO, VALIDADE, CONCURSO PUBLICO.";"1966-03-24T00:00:00";"https://dadosabertos.camara.leg.br/api/v2/orgaos/180";"";"";"";"";"";"1966-07-29T00:00:00";"4";"";"4";"MESA";"https://dadosabertos.camara.leg.br/api/v2/orgaos/4";"Ordinária (Art. 151, III, RICD)";"Não Informado";"5";"Arquivada";"923";"ARQUIVADO NOS TERMOS DO REGIMENTO INTERNO. DCN1 30 07 66 PAG 4463 COL 03.";""
"213691";"https://dadosabertos.camara.leg.br/api/v2/proposicoes/213691";"PL";"3543";"1966";"139";"Projeto de Lei";"DETERMINA A AQUISIÇÃO DE TODA A PRODUÇÃO DA FABRICA NACIONAL DE MOTORES PELO EXERCITO NACIONAL, EM CARATER PRIORITARIO.";"";"DETERMINAÇÃO, AQUISIÇÃO, EXERCITO, PRODUÇÃO, (FNM).";"1966-03-24T00:00:00";"https://dadosabertos.camara.leg.br/api/v2/orgaos/180";"";"";"";"";"";"1967-03-09T00:00:00";"4";"";"4";"MESA";"https://dadosabertos.camara.leg.br/api/v2/orgaos/4";"Ordinária (Art. 151, III, RICD)";"Não Informado";"5";"Arquivada";"923";"ARQUIVADO NOS TERMOS DO ARTIGO 104 DO REGIMENTO INTERNO. DCN1 10 03 67 PAG 0564 COL 03.";""
"213701";"https://dadosabertos.camara.leg.br/api/v2/proposicoes/213701";"PL";"3544";"1966";"139";"Projeto de Lei";"REGULAMENTA A AQUISIÇÃO DE JOIAS, TRATA DO COMERCIO CLANDESTINO E DA SONEGAÇÃO FISCAL.";"";"REGULAMENTAÇÃO, AQUISIÇÃO, JOIA, CONTRABANDO, ATIVIDADE CLANDESTINA, CLANDESTINIDADE, SONEGAÇÃO FISCAL.";"1966-03-24T00:00:00";"https://dadosabertos.camara.leg.br/api/v2/orgaos/180";"";"";"";"";"";"1968-04-03T00:00:00";"4";"";"4";"MESA";"https://dadosabertos.camara.leg.br/api/v2/orgaos/4";"Ordinária (Art. 151, III, RICD)";"Não Informado";"5";"Arquivada";"923";"ARQUIVADO NOS TERMOS DO REGIMENTO INTERNO. DCN1 04 04 68 PAG 1098 COL 01.";""
"213710";"https://dadosabertos.camara.leg.br/api/v2/proposicoes/213710";"PL";"3545";"1966";"139";"Projeto de Lei";"DISPÕE SOBRE A CONTAGEM DO TEMPO DE SERVIÇO, E DA OUTRAS PROVIDENCIAS.";"";"NORMAS, CONTAGEM, TEMPO DE SERVIÇO.";"1966-03-24T00:00:00";"https://dadosabertos.camara.leg.br/api/v2/orgaos/180";"";"";"";"";"";"1971-06-16T00:00:00";"4";"";"4";"MESA";"https://dadosabertos.camara.leg.br/api/v2/orgaos/4";"Ordinária (Art. 151, III, RICD)";"Não Informado";"5";"Arquivada";"923";"DESPACHO AO ARQUIVO (REJEITADO). DCN1 17 06 71 PAG 1945 COL 02.";""
"213719";"https://dadosabertos.camara.leg.br/api/v2/proposicoes/213719";"PL";"3546";"1966";"139";"Projeto de Lei";"DEFINE A EXPORTAÇÃO CLANDESTINA DE MINERAIS E MINERIOS COM CRIME CONTRA A SEGURANÇA NACIONAL.";"";"DEFINIÇÃO, CONTRABANDO, MINERIO, MINERAL, PRODUTO MINERAL, CRIME CONTRA A SEGURANÇA NACIONAL.";"1966-03-24T00:00:00";"https://dadosabertos.camara.leg.br/api/v2/orgaos/180";"";"";"";"";"";"1967-03-09T00:00:00";"4";"";"4";"MESA";"https://dadosabertos.camara.leg.br/api/v2/orgaos/4";"Ordinária (Art. 151, III, RICD)";"Não Informado";"5";"Arquivada";"923";"ARQUIVADO NOS TERMOS DO ARTIGO 104 DO REGIMENTO INTERNO. DCN1 10 03 67 PAG 0564 COL 03.";""
"213728";"https://dadosabertos.camara.leg.br/api/v2/proposicoes/213728";"PL";"3547";"1966";"139";"Projeto de Lei";"ACRESCENTA PARAGRAFOS AO ARTIGO 32 DA LEI Nº 3.807, DE 26 DE AGOSTO DE 1960 - LEI ORGANICA DA PREVIDENCIA SOCIAL.";"TEMPO DE SERVIÇO PRESTADO EM QUALQUER ATIVIDADE PUBLICA FEDERAL, ESTADUAL, MUNICIPAL OU AUTARQUICA, SOCIEDADE DE ECONOMIA MISTA E CORPORAÇÃO MILITAR, DESDE QUE O TEMPO DE SERVIÇO NO SIRVA PARA OUTRA APOSENTDADORIA).";"ALTERAÇÃO, LEGISLAÇÃO PREVIDENCIARIA, LEI ORGANICA DA PREVIDENCIA SOCIAL, CONTAGEM RECIPROCA, TEMPO DE SERVIÇO, SERVIÇO PUBLICO, UNIÃO FEDERAL, ESTADOS, MUNICIPIOS, AUTARQUIA, SOCIEDADE DE ECONOMIA MISTA, APOSENTADORIA.";"1966-03-24T00:00:00";"https://dadosabertos.camara.leg.br/api/v2/orgaos/180";"";"";"";"";"";"1969-11-30T00:00:00";"4";"";"4";"MESA";"https://dadosabertos.camara.leg.br/api/v2/orgaos/4";"Ordinária (Art. 151, III, RICD)";"Não Informado";"5";"Arquivada";"923";"ARQUIVADO NOS TERMOS DO ARTIGO 58 PARAGRAFO SEGUNDO DA CONSTITUIÇÃO FEDERAL E ARTIGOS 182 E 197 DO REGIMENTO INTERNO. DCN1 01 12 69 PAG 0749 COL 02.";""
"213737";"https://dadosabertos.camara.leg.br/api/v2/proposicoes/213737";"PL";"3548";"1966";"139";"Projeto de Lei";"AUTORIZA O PODER EXECUTIVO A ERIGIR UMA ESTATUA EM HOMENAGEM A MARIZ E BARROS NO ATERRO DA GLORIA.";"";"AUTORIZAÇÃO, EXECUTIVO, CONSTRUÇÃO, MONUMENTO, HOMENAGEM, PERSONAGEM ILUSTRE, ESTADO, (GB).";"1966-03-24T00:00:00";"https://dadosabertos.camara.leg.br/api/v2/orgaos/180";"";"";"";"";"";"1967-03-09T00:00:00";"4";"";"4";"MESA";"https://dadosabertos.camara.leg.br/api/v2/orgaos/4";"Ordinária (Art. 151, III, RICD)";"Não Informado";"5";"Arquivada";"923";"ARQUIVADO NOS TERMOS DO ARTIGO 104 DO REGIMENTO INTERNO. DCN1 10 03 67 PAG 0564 COL 03.";""
"213747";"https://dadosabertos.camara.leg.br/api/v2/proposicoes/213747";"PL";"3549";"1966";"139";"Projeto de Lei";"ALTERA OS PARAGRAFOS PRIMEIRO E SEGUNDO DO ARTIGO 185 DO DECRETO-LEI Nº 2.063, DE 07 DE MARÇO DE 1940, QUE REGULAMENTA, SOB NOVOS MOLDES, AS OPERAÇÕES DE SEGUROS PRIVADOS E SUA FISCALIZAÇÃO.";"";"ALTERAÇÃO, DECRETO LEI FEDERAL, REGULAMENTAÇÃO, OPERAÇÃO FINANCEIRA, FISCALIZAÇÃO, SEGURO PRIVADO.";"1966-03-25T00:00:00";"https://dadosabertos.camara.leg.br/api/v2/orgaos/180";"";"";"";"";"";"1967-03-09T00:00:00";"4";"";"4";"MESA";"https://dadosabertos.camara.leg.br/api/v2/orgaos/4";"Ordinária (Art. 151, III, RICD)";"Não Informado";"5";"Arquivada";"923";"ARQUIVADO NOS TERMOS DO ARTIGO 104 DO REGIMENTO INTERNO. DCN1 10 03 67 PAG 0564 COL 03.";""
"213757";"https://dadosabertos.camara.leg.br/api/v2/proposicoes/213757";"PL";"3550";"1966";"139";"Projeto de Lei";"DA NOVA REDAÇÃO AOS ARTIGOS NºS 475, 478 E 500 DO DECRETO-LEI Nº 5.452, DE 01 DE MAIO DE 1943 (CONSOLIDAÇÃO DAS LEIS DO TRABALHO).";"TEMPO DE SERVIÇO PRESTADO EM QUALQUER ATIVIDADE.";"ALTERAÇÃO, LEGISLAÇÃO TRABALHISTA, CONSOLIDAÇÃO DAS LEIS DO TRABALHO (CLT), PRESTAÇÃO DE SERVIÇO, TEMPO DE SERVIÇO.";"1966-03-24T00:00:00";"https://dadosabertos.camara.leg.br/api/v2/orgaos/180";"";"";"";"";"";"1969-11-30T00:00:00";"4";"";"4";"MESA";"https://dadosabertos.camara.leg.br/api/v2/orgaos/4";"Ordinária (Art. 151, III, RICD)";"Não Informado";"5";"Arquivada";"923";"ARQUIVADO NOS TERMOS DO ARTIGO 58 PARAGRAFO SEGUNDO DA CONSTITUIÇÃO FEDERAL E ARTIGOS 182 E 197 DO REGIMENTO INTERNO. DCN1 01 12 69 PAG 0749 COL 02.";""
"213767";"https://dadosabertos.camara.leg.br/api/v2/proposicoes/213767";"PL";"3551";"1966";"139";"Projeto de Lei";"INSTITUI O QUADRO DE PESSOAL DO CONSELHO NACIONAL DE TELECOMUNICAÇÕES (CONTEL) E DA OUTRAS PROVIDENCIAS.";"";"CRIAÇÃO, QUADRO DE PESSOAL, (CONTEL).";"1966-03-25T00:00:00";"https://dadosabertos.camara.leg.br/api/v2/orgaos/180";"";"";"";"";"";"1966-04-26T00:00:00";"3";"";"4";"MESA";"https://dadosabertos.camara.leg.br/api/v2/orgaos/4";"Ordinária (Art. 151, III, RICD)";"Não Informado";"5";"Arquivada";"923";"DEFERIDA A MSC001721966, DO AUTOR, SOLICITANDO A RETIRADA DESTE PROJETO. DCN1 27 04 66 PAG 2104 COL 04.";""
"213777";"https://dadosabertos.camara.leg.br/api/v2/proposicoes/213777";"PL";"3552";"1966";"139";"Projeto de Lei";"MODIFICA A LETRA B DO ARTIGO 44 DO DECRETO Nº 49.977, DE 23 DE JANEIRO DE 1961, MODIFICADO PELO DECRETO Nº 1.640, DE 23 DE NOVEMBRO DE 1962, QUE DISPÕE SOBRE O VISTO CONSULAR EM FATURAS COMERCIAIS.";"";"ALTERAÇÃO, DECRETO FEDERAL, VISTO CONSULAR, FATURA, MULTA, HIPOTESE, EMENDA, RASURA.";"1966-03-25T00:00:00";"https://dadosabertos.camara.leg.br/api/v2/orgaos/180";"";"";"";"";"";"1967-03-09T00:00:00";"4";"";"4";"MESA";"https://dadosabertos.camara.leg.br/api/v2/orgaos/4";"Ordinária (Art. 151, III, RICD)";"Não Informado";"5";"Arquivada";"923";"ARQUIVADO NOS TERMOS DO ARTIGO 104 DO REGIMENTO INTERNO. DCN1 10 03 67 PAG 0564 COL 03.";""
