"id";"uri";"siglaTipo";"numero";"ano";"codTipo";"descricaoTipo";"ementa";"ementaDetalhada";"keywords";"dataApresentacao";"uriOrgaoNumerador";"uriPropAnterior";"uriPropPrincipal";"uriPropPosterior";"urlInteiroTeor";"urnFinal";"ultimoStatus_dataHora";"ultimoStatus_sequencia";"ultimoStatus_uriRelator";"ultimoStatus_idOrgao";"ultimoStatus_siglaOrgao";"ultimoStatus_uriOrgao";"ultimoStatus_regime";"ultimoStatus_descricaoTramitacao";"ultimoStatus_idTipoTramitacao";"ultimoStatus_descricaoSituacao";"ultimoStatus_idSituacao";"ultimoStatus_despacho";"ultimoStatus_url"
"159856";"https://dadosabertos.camara.leg.br/api/v2/proposicoes/159856";"INC";"13";"1966";"133";"Indicação";"SUGERE A COMISSÃO DE FINANÇAS A INICIATIVA DE CONSULTAS AOS ORGÃOS COMPETENTES DO PODER EXECUTIVO SOBRE OS REFLEXOS ECONOMICOS E SOCIAIS DOS FERIADOS E PONTOS FACULTATIVOS, A FIM DE ELABORAR ESTUDO A RESPEITO.";"";"SUGESTÃO, COMISSÃO DE FINANÇAS, INICIATIVA, CONSULTA, ORGÃO PUBLICO, EXECUTIVO, AVALIAÇÃO SOCIO ECONOMICA, FERIADOS, PONTO FACULTATIVO, ELABORAÇÃO, ESTUDO.";"1966-08-04T00:00:00";"https://dadosabertos.camara.leg.br/api/v2/orgaos/180";"";"";"";"";"";"1967-11-17T00:00:00";"4";"";"";"";"";"Ordinária (Art. 151, III, RICD)";"Não Informado";"5";"";"";"ARQUIVADO NOS TERMOS DO REGIMENTO INTERNO. DCN1 18 11 67 PAG 7777 COL 02.";""
"162510";"https://dadosabertos.camara.leg.br/api/v2/proposicoes/162510";"MSC";"2";"1966";"134";"Mensagem";"SUBMETE A CONSIDERAÇÃO DO CONGRESSO NACIONAL O DECRETO QUE DISPÕE SOBRE INTERVENÇÃO FEDERAL NO ESTADO DE ALAGOAS.";"";"SOLICITAÇÃO, APRECIAÇÃO, CONGRESSO NACIONAL, DECRETO FEDERAL, INTERVENÇÃO FEDERAL, ESTADO, (AL).";"1966-02-07T00:00:00";"https://dadosabertos.camara.leg.br/api/v2/orgaos/180";"";"";"";"";"";"1966-02-07T00:00:00";"3";"";"";"";"";"Ordinária (Art. 151, III, RICD)";"Não Informado";"5";"";"";"ARQUIVADO NOS TERMOS DO REGIMENTO INTERNO.";""
"162520";"https://dadosabertos.camara.leg.br/api/v2/proposicoes/162520";"MSC";"4";"1966";"134";"Mensagem";"SUBMETE A APRECIAÇÃO DO CONGRESSO NACIONAL O TEXTO DO ACORDO DE COOPERAÇÃO PARA UTILIZAÇÃO DE ENERGIA ATOMICA PARA FINS PACIFICOS, ASSINADO ENTRE O BRASIL E A SUIÇA NO RIO DE JANEIRO, A 26 DE MAIO DE 1965.";"";"SOLICITAÇÃO, APRECIAÇÃO, CONGRESSO NACIONAL, TEXTO, ATO INTERNACIONAL, ACORDO, COOPERAÇÃO, ENERGIA NUCLEAR, UTILIZAÇÃO PACIFICA, PAIS, SUIÇA.";"1966-02-10T00:00:00";"https://dadosabertos.camara.leg.br/api/v2/orgaos/180";"";"";"";"";"";"1967-01-19T00:00:00";"3";"";"";"";"";"Ordinária (Art. 151, III, RICD)";"Não Informado";"5";"";"";"TRANSFORMADO NO PROJETO DE DECRETO LEGISLATIVO 310/67. DCN1 07 04 67 PAG 1099 COL 04.";""
"162963";"https://dadosabertos.camara.leg.br/api/v2/proposicoes/162963";"MSC";"106";"1966";"134";"Mensagem";"SUBMETE A HOMOLOGAÇÃO DO CONGRESSO NACIONAL AS EMISSÕES DE PAPEL-MOEDA REALIZADAS EM DEZEMBRO DE 1965.";"";"SOLICITAÇÃO, HOMOLOGAÇÃO, CONGRESSO NACIONAL, EMISSÃO, PAPEL MOEDA.";"1966-04-11T00:00:00";"https://dadosabertos.camara.leg.br/api/v2/orgaos/180";"";"";"";"";"";"1966-04-27T00:00:00";"3";"";"";"";"";"Ordinária (Art. 151, III, RICD)";"Não Informado";"5";"";"";"TRANSFORMADA NO PROJETO DE DECRETO LEGISLATIVO 263/66. 
DCN1 04 05 66 PAG 2416 COL 01.";"http://www.camara.gov.br/proposicoesWeb/prop_mostrarintegra?codteor=1502617"
"163015";"https://dadosabertos.camara.leg.br/api/v2/proposicoes/163015";"MSC";"118";"1966";"134";"Mensagem";"SUBMETE A APRECIAÇÃO DO CONGRESSO NACIONAL O TEXTO DO PROTOCOLO PARA NOVA PRORROGAÇÃO DO ACORDO INTERNACIONAL DO AÇUCAR DE 1958, ADOTADO EM GENEBRA, A 14 DE OUTUBRO DE 1965.";"";"SOLICITAÇÃO, APRECIAÇÃO, CONGRESSO NACIONAL, TEXTO, ATO INTERNACIONAL, PROTOCOLO, PRORROGAÇÃO, ACORDO INTERNACIONAL, AÇUCAR.";"1966-05-11T00:00:00";"https://dadosabertos.camara.leg.br/api/v2/orgaos/180";"";"";"";"";"";"1966-06-30T00:00:00";"3";"";"";"";"";"Ordinária (Art. 151, III, RICD)";"Não Informado";"5";"";"";"TRANSFORMADO NO PROJETO DE DECRETO LEGISLATIVO 280/66. 
DCN1 09 08 66 PAG 4780 COL 01.";"http://www.camara.gov.br/proposicoesWeb/prop_mostrarintegra?codteor=1507115"
"163020";"https://dadosabertos.camara.leg.br/api/v2/proposicoes/163020";"MSC";"119";"1966";"134";"Mensagem";"SUBMETE A APRECIAÇÃO DO CONGRESSO NACIONAL O TEXTO DO ACORDO CULTURAL ASSINADO ENTRE O BRASIL E A REPUBLICA DA COREIA, NO RIO DE JANEIRO, A 07 DE FEVEREIRO DE 1966.";"";"SOLICITAÇÃO, APRECIAÇÃO, CONGRESSO NACIONAL, TEXTO, ATO INTERNACIONAL, ACORDO CULTURAL, PAIS, COREIA.";"1966-04-11T00:00:00";"https://dadosabertos.camara.leg.br/api/v2/orgaos/180";"";"";"";"";"";"1966-06-08T00:00:00";"3";"";"";"";"";"Ordinária (Art. 151, III, RICD)";"Não Informado";"5";"";"";"TRANSFORMADO NO PROJETO DE DECRETO LEGISLATIVO 273/66. DCN1 18 06 66 PAG 3942 COL 03.";"http://www.camara.gov.br/proposicoesWeb/prop_mostrarintegra?codteor=1505066"
"163032";"https://dadosabertos.camara.leg.br/api/v2/proposicoes/163032";"MSC";"122";"1966";"134";"Mensagem";"SUBMETE A APRECIAÇÃO DO CONGRESSO NACIONAL O TEXTO DA CONVENÇÃO INTERNACIONAL PARA SALVAGUARDA DA VIDA HUMANA NO MAR E DO REGULAMENTO PARA EVITAR ABALROAMENTO, ADOTADOS EM LONDRES, A 17 DE JUNHO DE 1960.";"";"SOLICITAÇÃO, APRECIAÇÃO, CONGRESSO NACIONAL, TEXTO, ATO INTERNACIONAL, CONVENÇÃO INTERNACIONAL, SALVAGUARDA, VIDA HUMANA, MAR, REGULAMENTO, ABALROAMENTO.";"1966-04-13T00:00:00";"https://dadosabertos.camara.leg.br/api/v2/orgaos/180";"";"";"";"";"";"1966-06-30T00:00:00";"3";"";"";"";"";"Ordinária (Art. 151, III, RICD)";"Não Informado";"5";"";"";"TRANSFORMADO NO PROJETO DE DECRETO LEGISLATIVO 281/66. 
DCN1 09 08 66 PAG 4780 COL 01.";"http://www.camara.gov.br/proposicoesWeb/prop_mostrarintegra?codteor=1508292"
"163052";"https://dadosabertos.camara.leg.br/api/v2/proposicoes/163052";"MSC";"128";"1966";"134";"Mensagem";"ENCAMINHA TEXTO DA CONVENÇÃO 122 SOBRE POLITICA DE EMPREGO DA ORGANIZAÇÃO INTERNACIONAL DO TRABALHO.";"";"ENCAMINHAMENTO, TEXTO, ATO INTERNACIONAL, CONVENÇÃO INTERNACIONAL, (OIT), POLITICA, EMPREGO.";"1966-04-19T00:00:00";"https://dadosabertos.camara.leg.br/api/v2/orgaos/180";"";"";"";"";"";"1966-06-08T00:00:00";"3";"";"";"";"";"Ordinária (Art. 151, III, RICD)";"Não Informado";"5";"";"";"TRANSFORMADO NO PROJETO DE DECRETO LEGISLATIVO 272/66. 
DCN1 18 06 66 PAG 3942 COL 03.";"http://www.camara.gov.br/proposicoesWeb/prop_mostrarintegra?codteor=1505044"
"163058";"https://dadosabertos.camara.leg.br/api/v2/proposicoes/163058";"MSC";"129";"1966";"134";"Mensagem";"ENCAMINHA TEXTO DO ACORDO CULTURAL ASSINADO ENTRE O BRASIL E EL SALVADOR, ASSINADO NO RIO DE JANEIRO, EM 30 DE NOVEMBRO DE 1966.";"";"ENCAMINHAMENTO, TEXTO, ATO INTERNACIONAL, ACORDO CULTURAL, PAIS, EL SALVADOR.";"1966-04-19T00:00:00";"https://dadosabertos.camara.leg.br/api/v2/orgaos/180";"";"";"";"";"";"1966-05-18T00:00:00";"3";"";"";"";"";"Ordinária (Art. 151, III, RICD)";"Não Informado";"5";"";"";"TRANSFORMADO NO PROJETO DE DECRETO LEGISLATIVO 267/66. 
DCN1 02 06 66 PAG 3393 COL 04.";"http://www.camara.gov.br/proposicoesWeb/prop_mostrarintegra?codteor=1504421"
"163130";"https://dadosabertos.camara.leg.br/api/v2/proposicoes/163130";"MSC";"149";"1966";"134";"Mensagem";"ENCAMINHA TEXTO DA EMENDA AO ARTIGO 28 DA CONVENÇÃO DA ORGANIZAÇÃO MARITIMA CONSULTIVA INTERGOVERNAMENTAL.";"";"ENCAMINHAMENTO, TEXTO, ATO INTERNACIONAL, EMENDA, CONVENÇÃO INTERNACIONAL, (IMCO).";"1966-04-19T00:00:00";"https://dadosabertos.camara.leg.br/api/v2/orgaos/180";"";"";"";"";"";"1966-05-18T00:00:00";"3";"";"";"";"";"Ordinária (Art. 151, III, RICD)";"Não Informado";"5";"";"";"TRANSFORMADA NO PROJETO DE DECRETO LEGISLATIVO 266/66. DCN1 02 06 66 PAG 3393 COL 04.";"http://www.camara.gov.br/proposicoesWeb/prop_mostrarintegra?codteor=1503699"
"163215";"https://dadosabertos.camara.leg.br/api/v2/proposicoes/163215";"MSC";"171";"1966";"134";"Mensagem";"ACORDO SOBRE PRESTAÇÃO DE ASSISTENCIA TECNICA A SUDENE ENTRE O BRASIL E A UNIÃO PAN-AMERICANA, SECRETARIA GERAL DA OEA.";"";"SOLICITAÇÃO, APRECIAÇÃO, CONGRESSO NACIONAL, TEXTO, ATO INTERNACIONAL, ASSISTENCIA TECNICA, (SUDENE), SECRETARIA GERAL, (OEA).";"1966-05-06T00:00:00";"https://dadosabertos.camara.leg.br/api/v2/orgaos/180";"";"";"";"";"";"1967-10-11T00:00:00";"3";"";"";"";"";"Ordinária (Art. 151, III, RICD)";"Não Informado";"5";"";"";"TRANSFORMADO NO PROJETO DE DECRETO LEGISLATIVO 40/67. DCN1 07 11 67 PAG 7324 COL 02.";"http://www.camara.gov.br/proposicoesWeb/prop_mostrarintegra?codteor=1522157"
"163315";"https://dadosabertos.camara.leg.br/api/v2/proposicoes/163315";"MSC";"199";"1966";"134";"Mensagem";"SUBMETE A APRECIAÇÃO DO CONGRESSO NACIONAL O TEXTO DA CONVENÇÃO 118 SOBRE A IGUALDADE DE TRATAMENTO DOS NACIONAIS E NÃO-NACIONAIS EM MATERIA DE PREVIDENCIA SOCIAL, ADOTADA EM GENEBRA, A 30 DE JUNHO DE 1962, PELA CONFERENCIA INTERNACIONAL DO TRABALHO.";"";"SOLICITAÇÃO, APRECIAÇÃO, CONGRESSO NACIONAL, TEXTO, ATO INTERNACIONAL, CONVENÇÃO, (OIT), IGUALDADE, TRATAMENTO, PREVIDENCIA SOCIAL, TRABALHADOR, BRASILEIROS, ESTRANGEIRO.";"1966-05-06T00:00:00";"https://dadosabertos.camara.leg.br/api/v2/orgaos/180";"";"";"";"";"";"1967-11-22T00:00:00";"3";"";"";"";"";"Ordinária (Art. 151, III, RICD)";"Não Informado";"5";"";"";"TRANSFORMADO NO PROJETO DE DECRETO LEGISLATIVO 53/67. DCN1 01 12 67 PAG 8642 COL 03.";"http://www.camara.gov.br/proposicoesWeb/prop_mostrarintegra?codteor=1522264"
"163325";"https://dadosabertos.camara.leg.br/api/v2/proposicoes/163325";"MSC";"201";"1966";"134";"Mensagem";"TEXTO DA EMENDA AOS ARTIGOS 18 DA CONVENÇÃO DA ORGANIZAÇÃO MARITIMA CONSULTIVA INTERGOVERNAMENTAL.";"";"SOLICITAÇÃO, APRECIAÇÃO, TEXTO, ATO INTERNACIONAL, CONVENÇÃO INTERNACIONAL, (IMCO).";"1966-05-06T00:00:00";"https://dadosabertos.camara.leg.br/api/v2/orgaos/180";"";"";"";"";"";"1966-06-08T00:00:00";"3";"";"";"";"";"Ordinária (Art. 151, III, RICD)";"Não Informado";"5";"";"";"TRANSFORMADO NO PROJETO DE DECRETO LEGISLATIVO 274/66. DCN1 18 06 66 PAG 3942 COL 03.";"http://www.camara.gov.br/proposicoesWeb/prop_mostrarintegra?codteor=1505489"
"163333";"https://dadosabertos.camara.leg.br/api/v2/proposicoes/163333";"MSC";"203";"1966";"134";"Mensagem";"DECIMA QUARTA EXPOSIÇÃO SOBRE O PROGRAMA DE REAPARELHAMENTO ECONOMICO, REFERENTE AO EXERCICIO DE 1965.";"";"ENCAMINHAMENTO, EXPOSIÇÃO DE MOTIVOS, PROGRAMA, REAPARELHAMENTO, ECONOMIA.";"1966-05-06T00:00:00";"https://dadosabertos.camara.leg.br/api/v2/orgaos/180";"";"";"";"";"";"1987-07-30T00:00:00";"3";"";"";"";"";"Ordinária (Art. 151, III, RICD)";"Não Informado";"5";"";"";"ARQUIVADO NOS TERMOS ARTIGO OITAVO DO ATO DA MESA 1/87. DCN1 01 07 87 PAG 2336 COL 01.";""
"163350";"https://dadosabertos.camara.leg.br/api/v2/proposicoes/163350";"MSC";"209";"1966";"134";"Mensagem";"SUBMETE A APRECIAÇÃO DO CONGRESSO NACIONAL AS CONTAS DO GOVERNO FEDERAL (ADMINISTRAÇÃO DIRETA E BANCO DO DESENVOLVIMENTO ECONOMICO), RELATIVOS AO EXERCICIO DE 1965, ACOMPANHADAS DE PARECER DO TRIBUNAL DE CONTAS DA UNIÃO.";"";"SOLICITAÇÃO, APRECIAÇÃO, CONGRESSO NACIONAL, CONTAS, GOVERNO FEDERAL, PRESIDENTE DA REPUBLICA, PRESTAÇÃO DE CONTAS, ADMINISTRAÇÃO DIRETA, (DNDE), PARECER, (TCU).";"1966-05-06T00:00:00";"https://dadosabertos.camara.leg.br/api/v2/orgaos/180";"";"";"";"";"";"1969-11-19T00:00:00";"3";"";"";"";"";"Ordinária (Art. 151, III, RICD)";"Não Informado";"5";"";"";"TRANSFORMADA NO PROJETO DE DECRETO LEGISLATIVO 14/71. DCN1 04 04 70 PAG 0020 COL 02 E PAG 0210 COL 03.";""
"163364";"https://dadosabertos.camara.leg.br/api/v2/proposicoes/163364";"MSC";"212";"1966";"134";"Mensagem";"AUTORIZA O PODER EXECUTIVO A PARTICIPAR DA CRIAÇÃO NACIONAL DE SEGURANÇA, HIGIENE E MEDICINA DO TRABALHO E DA OUTRAS PROVIDENCIAS.";"";"AUTORIZAÇÃO, EXECUTIVO, PARTICIPAÇÃO, CRIAÇÃO, CENTRO NACIONAL, SEGURANÇA DO TRABALHO, HIGIENE DO TRABALHO, MEDICINA DO TRABALHO.";"1966-05-05T00:00:00";"https://dadosabertos.camara.leg.br/api/v2/orgaos/180";"";"";"";"http://www.camara.gov.br/proposicoesWeb/prop_mostrarintegra?codteor=1093916";"";"1966-05-05T00:00:00";"3";"";"";"";"";"Ordinária (Art. 151, III, RICD)";"Não Informado";"5";"";"";"APROVAÇÃO DA MSC003021966, DO AUTOR, SOLICITANDO A RETIRADA DESTA MENSAGEM. DCN1 08 06 66 PAG 3530 COL 03.";""
"163461";"https://dadosabertos.camara.leg.br/api/v2/proposicoes/163461";"MSC";"240";"1966";"134";"Mensagem";"TEXTO DA CONVENÇÃO 117, SOBRE OBJETIVOS E NORMAS DE BASE DA POLITICA SOCIAL, ADOTADA A 22 DE JUNHO DE 1962, POR OCASIÃO DA QUADRAGESIMA SEXTA SESSÃO DA CONFERENCIA INTERNACIONAL DO TRABALHO.";"";"SOLICITAÇÃO, APRECIAÇÃO, TEXTO, ATO INTERNACIONAL, CONVENÇÃO, (OIT), OBJETIVO, NORMAS, POLITICA SOCIAL.";"1966-05-20T00:00:00";"https://dadosabertos.camara.leg.br/api/v2/orgaos/180";"";"";"";"";"";"1966-08-17T00:00:00";"3";"";"";"";"";"Ordinária (Art. 151, III, RICD)";"Não Informado";"5";"";"";"TRANSFORMADO NO PROJETO DE DECRETO LEGISLATIVO 286/66. 
DCN1 27 08 66 PAG 5470 COL 04.";"http://www.camara.gov.br/proposicoesWeb/prop_mostrarintegra?codteor=1509005"
"163466";"https://dadosabertos.camara.leg.br/api/v2/proposicoes/163466";"MSC";"241";"1966";"134";"Mensagem";"TEXTO DA EMENDA 1/64, SOBRE APLICAÇÃO UNIVERSAL DAS CONVENÇÕES DA OIT A TODAS A POPULAÇÕES, INCLUSIVE AS QUE NÃO SEJAM ADMINISTRADAS POR SI PROPRIAS.";"";"SOLICITAÇÃO, APRECIAÇÃO, CONGRESSO NACIONAL, EMENDA, (OIT), APLICAÇÃO, CONVENÇÃO, POPULAÇÃO.";"1966-05-20T00:00:00";"https://dadosabertos.camara.leg.br/api/v2/orgaos/180";"";"";"";"";"";"1967-05-24T00:00:00";"3";"";"";"";"";"Ordinária (Art. 151, III, RICD)";"Não Informado";"5";"";"";"TRANSFORMADO NO PROJETO DE DECRETO LEGISLATIVO 14/67. DCN1 07 07 67 PAG 3011 COL 03.";""
"163470";"https://dadosabertos.camara.leg.br/api/v2/proposicoes/163470";"MSC";"242";"1966";"134";"Mensagem";"TEXTO DO INSTRUMENTO DA EMENDA 3/64, DA CONSTITUIÇÃO DA ORGANIZAÇÃO INTERNACIONAL DO TRABALHO ADOTADO EM GENEBRA EM 09 DE JULHO DE 1964, RELATIVA A EXPULSÃO DA OIT DE TODO O MEMBRO QUE TENHA SIDO EXPULSO DA ONU.";"";"SOLICITAÇÃO, APRECIAÇÃO, CONGRESSO NACIONAL, TEXTO, ATO INTERNACIONAL, EMENDA, (OIT), EXPULSÃO, MEMBROS.";"1966-05-20T00:00:00";"https://dadosabertos.camara.leg.br/api/v2/orgaos/180";"";"";"";"";"";"1966-09-14T00:00:00";"3";"";"";"";"";"Ordinária (Art. 151, III, RICD)";"Não Informado";"5";"";"";"TRANSFORMADA NO PROJETO DE DECRETO LEGISLATIVO 296/66. 
DCN1 01 10 66 PAG 6497 COL 04.";"http://www.camara.gov.br/proposicoesWeb/prop_mostrarintegra?codteor=1511136"
"163472";"https://dadosabertos.camara.leg.br/api/v2/proposicoes/163472";"MSC";"243";"1966";"134";"Mensagem";"TEXTO DO ACORDO SOBRE TRANSPORTES AEREOS REGULARES ASSINADO COM A REPUBLICA FRANCESA, A 29 DE OUTUBRO DE 1965.";"";"SOLICITRAÇÃO, APRECIAÇÃO, CONGRESSO NACIONAL, TEXTO, ATO INTERNACIONAL, ACORDO INTERNACIONAL, TRANSPORTE AEREO, PAIS, FRANÇA.";"1966-05-20T00:00:00";"https://dadosabertos.camara.leg.br/api/v2/orgaos/180";"";"";"";"";"";"1966-06-15T00:00:00";"3";"";"";"";"";"Ordinária (Art. 151, III, RICD)";"Não Informado";"5";"";"";"TRANSFORMADA NO PROJETO DE DECRETO LEGISLATIVO 276/66.
DCN1 29 06 66 PAG 4266 COL 01.";"http://www.camara.gov.br/proposicoesWeb/prop_mostrarintegra?codteor=1505720"
"163676";"https://dadosabertos.camara.leg.br/api/v2/proposicoes/163676";"MSC";"298";"1966";"134";"Mensagem";"APROVA O TEXTO DA EMENDA DO PROGRAMA DE AGRICULTURA E RECURSOS NATURAIS ENTRE O GOVERNO DOS ESTADOS UNIDOS DO BRASIL E EUA, CELEBRADO NO RIO DE JANEIRO, EM 31 DE DEZEMBRO DE 1964.";"";"SOLICITAÇÃO, APROVAÇÃO, CONGRESSO NACIONAL, TEXTO, ATO INTERNACIONAL, EMENDA, PROGRAMA, AGRICULTURA, RECURSOS NATURAIS, (EUA).";"1966-05-24T00:00:00";"https://dadosabertos.camara.leg.br/api/v2/orgaos/180";"";"";"";"";"";"1966-06-30T00:00:00";"3";"";"";"";"";"Ordinária (Art. 151, III, RICD)";"Não Informado";"5";"";"";"TRANSFORMADA NO PROJETO DE DECRETO LEGISLATIVO 282/66.
DCN1 30 07 66 PÁG 4463 COL 04.";"http://www.camara.gov.br/proposicoesWeb/prop_mostrarintegra?codteor=1508594"
"163720";"https://dadosabertos.camara.leg.br/api/v2/proposicoes/163720";"MSC";"316";"1966";"134";"Mensagem";"SUBMETE A APRECIAÇÃO DO CONGRESSO NACIONAL TEXTO DO ACORDO BASICO DE COOPERAÇÃO TECNICA, ASSINADO ENTRE O BRASIL E A DINAMARCA, NO RIO DE JANEIRO, A 25 DE FEVEREIRO DE 1966.";"";"SOLICITAÇÃO, APRECIAÇÃO, CONGRESSO NACIONAL, TEXTO, ATO INTERNACIONAL, ACORDO INTERNACIONAL, COOPERAÇÃO TECNICA, PAIS, DINAMARCA.";"1966-06-07T00:00:00";"https://dadosabertos.camara.leg.br/api/v2/orgaos/180";"";"";"";"";"";"1966-06-15T00:00:00";"3";"";"";"";"";"Ordinária (Art. 151, III, RICD)";"Não Informado";"5";"";"";"TRANSFORMADA NO PROJETO DE DECRETO LEGISLATIVO 277/66. DCN1 29 06 66 PAG 4266 COL 01.";"http://www.camara.gov.br/proposicoesWeb/prop_mostrarintegra?codteor=1506989"
"163841";"https://dadosabertos.camara.leg.br/api/v2/proposicoes/163841";"MSC";"350";"1966";"134";"Mensagem";"ENCAMINHA TEXTO DA CONVENÇÃO 120, SOBRE HIGIENE NO COMERCIO E NOS ESCRITORIOS, ADOTADA PELA CONFERENCIA INTERNACIONAL DO TRABALHO EM QUADRAGESIMA OITAVA SESSÃO.";"";"ENCAMINHAMENTO, TEXTO, ATO INTERNACIONAL, CONVENÇÃO, (OIT), HIGIENE DO TRABALHO, COMERCIO, ESCRITORIO.";"1966-06-15T00:00:00";"https://dadosabertos.camara.leg.br/api/v2/orgaos/180";"";"";"";"";"";"1967-09-20T00:00:00";"3";"";"";"";"";"Ordinária (Art. 151, III, RICD)";"Não Informado";"5";"";"";"TRANSFORMADO NO PROJETO DE DECRETO LEGISLATIVO 36/67. DCN1 07 10 67 PAG 6415 COL 01.";""
"163844";"https://dadosabertos.camara.leg.br/api/v2/proposicoes/163844";"MSC";"351";"1966";"134";"Mensagem";"ENCAMINHA TEXTO DA CONVENÇÃO 124 SOBRE EXAME MEDICO APTIDÃO DE ADOLESCENTES AO EMPREGO NOS TRABALHOS SUBTERRANEOS DAS MINAS, ADOTADA PELA CONFERENCIA INTERNACIONAL DO TRABALHO EM SUA QUADRAGESIMA NONA SESSÃO.";"";"ENCAMINHAMENTO, TEXTO, ATO INTERNACIONAL, CONVENÇÃO, (OIT), EXAME MEDICO, ADOLESCENTE, EMPREGO, TRABALHO, MINAS, SUB SOLO.";"1966-06-15T00:00:00";"https://dadosabertos.camara.leg.br/api/v2/orgaos/180";"";"";"";"";"";"1968-06-19T00:00:00";"3";"";"";"";"";"Ordinária (Art. 151, III, RICD)";"Não Informado";"5";"";"";"TRANSFORMADA NO PROJETO DE DECRETO LEGISLATIVO 83/68. DCN1 18 09 68 PAG 6204 COL 03. REP: DCN1 06 05 70 PAG 1067 COL 01.";""
"163913";"https://dadosabertos.camara.leg.br/api/v2/proposicoes/163913";"MSC";"371";"1966";"134";"Mensagem";"SUBMETE A APRECIAÇÃO DO CONGRESSO NACIONAL O TEXTO DA CONVENÇÃO 123, SOBRE A IDADE MINIMA DE ADMISSÃO AOS TRABALHOS SUBTERRANEOS NAS MINAS, ADOTADA PELA CONFERENCIA INTERNACIONAL DO TRABALHO, EM SUA QUADRAGESIMA NONA SESSÃO, EM 1965.";"";"SOLICITAÇÃO, APRECIAÇÃO, CONGRESSO NACIONAL, CONVENÇÃO, (OIT), LIMITE DE IDADE, ADMISSÃO, TRABALHO, SUB SOLO, MINAS.";"1966-06-20T00:00:00";"https://dadosabertos.camara.leg.br/api/v2/orgaos/180";"";"";"";"";"";"1987-06-30T00:00:00";"3";"";"";"";"";"Ordinária (Art. 151, III, RICD)";"Não Informado";"5";"";"";"ARQUIVADO NOS TERMOS DO ARTIGO OITAVO DO ATO DA MESA 1/87. DCN1 01 07 87 PAG 2336 COL 01.";""
"163915";"https://dadosabertos.camara.leg.br/api/v2/proposicoes/163915";"MSC";"372";"1966";"134";"Mensagem";"SUBMETE A APRECIAÇÃO DO CONGRESSO NACIONAL, O TEXTO DA CONVENÇÃO 119, RELATIVA A PROTEÇÃO DAS MAQUINAS, ADOTADA NA QUADRAGESIMA SETIMA CONFERENCIA INTERNACIONAL DO TRABALHO, EM GENEBRA, EM JUNHO DE 1963.";"DISPOSITIVOS DE SEGURANÇA E PROTEÇÃO NAS MAQUINAS PARA PROTEÇÃO DO TRABALHADOR).";"SOLICITAÇÃO, APRECIAÇÃO, CONGRESSO NACIONAL, TEXTO, ATO INTERNACIONAL, CONVENÇÃO INTERNACIONAL, (OIT), PROTEÇÃO, MAQUINA, SEGURANÇA DO TRABALHO, TRABALHADOR.";"1966-06-20T00:00:00";"https://dadosabertos.camara.leg.br/api/v2/orgaos/180";"";"";"";"";"";"1984-09-12T00:00:00";"20";"";"";"";"";"Ordinária (Art. 151, III, RICD)";"Não Informado";"5";"";"";"TRANSFORMADA NO PROJETO DE DECRETO LEGISLATIVO 69/84.";""
"163919";"https://dadosabertos.camara.leg.br/api/v2/proposicoes/163919";"MSC";"373";"1966";"134";"Mensagem";"SUBMETE A APRECIAÇÃO DO CONGRESSO NACIONAL O TEXTO DA CONVENÇÃO 121 SOBRE PRESTAÇÕES EM CASO DE ACIDENTES DO TRABALHO E DE DOENÇAS PROFISSIONAIS, ADOTADA PELA CONFERENCIA INTERNACIONAL DO TRABALHO EM SUA QUADRAGESIMA OITAVA SESSÃO, EM 1964.";"";"SOLICITAÇÃO, APRECIAÇÃO, CONGRESSO NACIONAL, TEXTO, CONVENÇÃO INTERNACIONAL, TRABALHO, INDENIZAÇÃO, ACIDENTE DE TRABALHO, DOENÇA PROFISSIONAL, ADOÇÃO, CONFERENCIA, (OIT).";"1966-06-20T00:00:00";"https://dadosabertos.camara.leg.br/api/v2/orgaos/180";"";"";"";"";"";"1987-06-30T00:00:00";"3";"";"";"";"";"Ordinária (Art. 151, III, RICD)";"Não Informado";"5";"";"";"ARQUIVADO NOS TERMOS DO ARTIGO OITAVO DO ATO DA MESA 1/87. DCN1 01 07 87 PAG 2336 COL 01.";""
"164100";"https://dadosabertos.camara.leg.br/api/v2/proposicoes/164100";"MSC";"433";"1966";"134";"Mensagem";"COMUNICA A ABERTURA DO CREDITO EXTRAORDINARIO DE Cr$ 2.200.000.000,00 DESTINADO A SITUAÇÃO DE CALAMIDADE PUBLICA DECORRENTE DAS ENCHENTES, SENDO Cr$ 1.200.000.000,00 PARA PERNAMBUCO E Cr$ 1.000.000.000,00 PARA A BAHIA.";"";"COMUNICAÇÃO, ABERTURA, CREDITO EXTRAORDINARIO, CALAMIDADE PUBLICA, AUXILIO, INUNDAÇÃO, ESTADO, (PE), (BA).";"1966-07-28T00:00:00";"https://dadosabertos.camara.leg.br/api/v2/orgaos/180";"";"";"";"";"";"1987-06-30T00:00:00";"3";"";"";"";"";"Ordinária (Art. 151, III, RICD)";"Não Informado";"5";"";"";"ARQUIVADO NOS TERMOS DO ARTIGO OITAVO DO ATO DA MESA 1/87. DCN1 01 07 87 PAG 2336 COL 01.";""
"164107";"https://dadosabertos.camara.leg.br/api/v2/proposicoes/164107";"MSC";"436";"1966";"134";"Mensagem";"COMUNICA ABERTURA DO CREDITO EXTRAORDINARIO DE CRÇ 6.300.000.000,00 DESTINADO A ATENDER A SITUAÇÃO DE CALAMIDADE PUBLICA, DECORRENTE DAS CHUVAS TORRENCIAIS RECENTEMENTE OCORRIDAS NOS ESTADOS DE PERNAMBUCO, BAHIA, SERGIPE E ALAGOAS.";"";"COMUNICAÇÃO, ABERTURA, CREDITO EXTRAORDINARIO, ATENDIMENTO, CALAMIDADE PUBLICA, INUNDAÇÃO, ESTADO, (PE), (BA), (SE), (AL).";"1966-08-03T00:00:00";"https://dadosabertos.camara.leg.br/api/v2/orgaos/180";"";"";"";"";"";"1987-06-30T00:00:00";"3";"";"";"";"";"Ordinária (Art. 151, III, RICD)";"Não Informado";"5";"";"";"ARQUIVADO NOS TERMOS DO ARTIGO OITAVO DO ATO DA MESA 1/87. DCN1 01 07 87 PAG 2336 COL 01.";""
"164122";"https://dadosabertos.camara.leg.br/api/v2/proposicoes/164122";"MSC";"443";"1966";"134";"Mensagem";"SUBMETE A CONSIDERAÇÃO DO CONGRESSO NACIONAL, ACOMPANHADAS DE PARECER PREVIO DO TRIBUNAL DE CONTAS DO DISTRITO FEDERAL, AS CONTAS DO GOVERNO DO DISTRITO FEDERAL RELATIVAS AO EXERCICIO FINANCEIRO DE 1965.";"";"SOLICITAÇÃO, APRESENTAÇÃO, CONGRESSO NACIONAL, ACOMPANHAMENTO, PARECER, (TCDF), CONTAS, (PDF), EXERCICIO FINANCEIRO ANTERIOR.";"1966-08-03T00:00:00";"https://dadosabertos.camara.leg.br/api/v2/orgaos/180";"";"";"";"";"";"1966-08-03T00:00:00";"3";"";"";"";"";"Ordinária (Art. 151, III, RICD)";"Não Informado";"5";"";"";"ARQUIVADO NOS TERMOS DO REGIMENTO INTERNO.";""
"164183";"https://dadosabertos.camara.leg.br/api/v2/proposicoes/164183";"MSC";"458";"1966";"134";"Mensagem";"SUBMETE A CONSIDERAÇÃO DO CONGRESSO NACIONAL O TEXTO DA CONVENÇÃO DE VIENA SOBRE RELAÇÕES CONSULARES, ASSINADA A 24 DE ABRIL DE 1963.";"";"SOLICITAÇÃO, APRECIAÇÃO, CONGRESSO NACIONAL, TEXTO, TRATADO DE VIENA, RELAÇÕES DIPLOMATICAS.";"1966-08-02T00:00:00";"https://dadosabertos.camara.leg.br/api/v2/orgaos/180";"";"";"";"";"";"1966-09-14T00:00:00";"3";"";"";"";"";"Ordinária (Art. 151, III, RICD)";"Não Informado";"5";"";"";"TRANSFORMADA NO PROJETO DE DECRETO LEGISLATIVO 297/66. 
DCN1 01 10 66 PAG 6497 COL 04.";"http://www.camara.gov.br/proposicoesWeb/prop_mostrarintegra?codteor=1511149"
"164188";"https://dadosabertos.camara.leg.br/api/v2/proposicoes/164188";"MSC";"459";"1966";"134";"Mensagem";"ENCAMINHA TEXTO DA CONVENÇÃO RELATIVA A LUTA CONTRA A DISCRIMINAÇÃO NO CAMPO DO ENSINO, APROVADO PELA CONVENÇÃO DA UNESCO, EM PARIS, A 14 DE DEZEMBRO DE 1960.";"";"ENCAMINHAMENTO, TEXTO, CONVENÇÃO INTERNACIONAL, LUTA, DISCRIMICAÇÃO, ENSINO, APROVAÇÃO, (UNESCO).";"1966-08-02T00:00:00";"https://dadosabertos.camara.leg.br/api/v2/orgaos/180";"";"";"";"";"";"1967-06-07T00:00:00";"3";"";"";"";"";"Ordinária (Art. 151, III, RICD)";"Não Informado";"5";"";"";"TRANSFORMADO NO PROJETO DE DECRETO LEGISLATIVO 18/67. DCN1 17 06 67 PAG 3507 COL 02.";"http://www.camara.gov.br/proposicoesWeb/prop_mostrarintegra?codteor=1521487"
"164210";"https://dadosabertos.camara.leg.br/api/v2/proposicoes/164210";"MSC";"466";"1966";"134";"Mensagem";"SUBMETE A APRECIAÇÃO DO CONGRESSO NACIONAL O TEXTO DO CONVENIO INTERNACIONAL PARA A CONSTITUIÇÃO DO INSTITUTO ITALO-LATINO-AMERICANO, ASSINADO EM ROMA, A 01 DE JUNHO DE 1966.";"";"SOLICITAÇÃO, APRECIAÇÃO, CONGRESSO NACIONAL, TEXTO, CONVENIO, AMBITO INTERNACIONAL, CRIAÇÃO, ENTIDADE, ITALIA, AMERICA LATINA.";"1966-08-03T00:00:00";"https://dadosabertos.camara.leg.br/api/v2/orgaos/180";"";"";"";"";"";"1966-08-10T00:00:00";"3";"";"";"";"";"Ordinária (Art. 151, III, RICD)";"Não Informado";"5";"";"";"TRANSFORMADA NO PROJETO DE DECRETO LEGISLATIVO 284/66. DCN1 19 08 66 PAG 5148 COL 01.";""
"164311";"https://dadosabertos.camara.leg.br/api/v2/proposicoes/164311";"MSC";"501";"1966";"134";"Mensagem";"ENCAMINHA TEXTO DO ACORDO DE COOPERAÇÃO NO CAMPO DOS USOS PACIFICOS DA ENERGIA ATOMICA ENTRE BRASIL E BOLIVIA.";"";"ENCAMINHAMENTO, TEXTO, ACORDO DE COOPERAÇÃO TECNICA, UTILIZAÇÃO PACIFICA, ENERGIA NUCLEAR, BRASIL, PAIS ESTRANGEIRO, BOLIVIA.";"1966-08-13T00:00:00";"https://dadosabertos.camara.leg.br/api/v2/orgaos/180";"";"";"";"";"";"1966-08-24T00:00:00";"3";"";"";"";"";"Ordinária (Art. 151, III, RICD)";"Não Informado";"5";"";"";"TRANSFORMADA NO PROJETO DE DECRETO LEGISLATIVO 290/66. 
DCN1 20 09 66 PAG 6011 COL 04.";"http://www.camara.gov.br/proposicoesWeb/prop_mostrarintegra?codteor=1509368"
